Rank,DOI,Discussion,Conclusions
1,10.1177/0269881116675513,"The present study demonstrated the efficacy of a high dose of psilocybin administered under supportive conditions to decrease symptoms of depressed mood and anxiety, and to increase quality of life in patients with a life-threatening cancer diagnosis. Eleven of 17 therapeutically relevant measures fulfilled conservative criteria for demonstrating efficacy of the high dose of psilocybin (Table 4, Figure 3). The data show that psilocybin produced large and significant decreases in clinician-rated and self-rated measures of depression, anxiety or mood disturbance, and increases in measures of quality of life, life meaning, death acceptance, and optimism. These effects were sustained at 6 months. For the clinician-rated measures of depression and anxiety, respectively, the overall rate of clinical response at 6 months was 78% and 83% and the overall rate of symptom remission was 65% and 57%. Participants attributed to the high-dose experience positive changes in attitudes about life, self, mood, relationships and spirituality, with over 80% endorsing moderately or higher increased well-being or life satisfaction. These positive effects were reflected in significant corresponding changes in ratings by community observers (friends, family, work colleagues) of participant attitudes and behavior.The results substantially extend the findings of a recent double-blind pilot study with a lower dose of psilocybin (14 mg/70 kg) in cancer patients that showed non-significant trends for benefits of psilocybin compared with placebo (niacin) on measures of depression and anxiety, with some significant decreases relative to baseline demonstrated at 1 to 6 months (Grob et al., 2011). The time-course, magnitude, and qualitative features of the high dose of psilocybin on session days were consistent with those observed in previous studies in healthy volunteers (Griffiths et al., 2006, 2011; Johnson et al., 2012).The significant association of mystical-type experience (MEQ30) during Session 1 with most of the enduring changes in therapeutic outcome measures 5 weeks later (Figure 5) is consistent with previous findings showing that such experiences on session days predict long-term positive changes in attitudes, mood, behavior, and spirituality (Garcia-Romeu et al., 2014; Griffiths et al., 2008, 2011). For most measures, this relationship continued to be significant when the intensity of overall psilocybin effect was controlled in a partial correlation analysis. This suggests that mystical-type experience per se has an important role apart from overall intensity of drug effect. Finally, a mediation analysis further suggested that mystical-type experience has a mediating role in positive therapeutic response.The observed decreases in psychological distress and anxiety about death may relate to recent epidemiological findings that lifetime psilocybin use was associated with significantly reduced odds of past month psychological distress and suicidality (Hendricks et al., 2015).An innovative feature of the study design was that participants and staff monitors were given instructions that obscured the actual psilocybin dose conditions to facilitate blinding and minimize expectancy effects, which are believed to be a significant determinant of classic hallucinogen effects (Griffiths et al., 2006; Metzner et al., 1965). Evidence of some success of this blinding was provided in a post-study questionnaire completed by staff and by significant treatment effects observed after Session 1 in participants who received the very low dose of psilocybin. Although it was assumed that 1 mg/70 kg would be largely pharmacologically inactive, some pharmacological activity of this dose cannot be ruled out entirely. Thus, it might have been preferable to use an even lower dose of psilocybin (e.g. 0.01 mg/70 kg) to assure pharmacological inactivity while maintaining the benefit of the instruction that psilocybin would be administered on each session. Although the low-dose comparison condition and instructions to participants and staff facilitated blinding and minimized expectancy effects, it should be noted that these experimental design features may be difficult to implement in research settings that require complete disclosure of specific study conditions or arms.Several additional experimental limitations should be noted. Participants were crossed over to the alternative dose condition after 5 weeks. Although this allowed assessment of acute and persisting effects of psilocybin in all study participants, it precluded double-blind assessment of efficacy of the high dose of psilocybin based on across group comparisons after 5 weeks. As in previous research, the study documented enduring increases in positive changes in attitudes and mood on both the participant-rated Persisting Effects Questionnaire and on the Community Observer Questionnaire . However, neither of these measures has been independently validated. Likewise, although the finding of significant decreases in depression and anxiety symptoms on both participant-rated and clinician-rated measures is a strength, the inclusion of blinded clinician ratings would further strengthen the study. The relatively small sample (n = 51) that was highly educated and predominately White limits the generality of conclusions.Finally, it is important to note that the overall approach of treating cancer-related psychological distress with psilocybin is limited by a variety of exclusion criteria (see online Supplementary material) and by the significant time and cost of professional support provided before, during, and after the psilocybin session. Patients may also be reluctant to participate in such an intervention because high doses of psilocybin have sometimes been associated with transient episodes of psychological distress or anxiety in patients.The neuropsychopharmacological mechanisms of psilocybin therapeutic effects remain speculative As a 5-HT2A agonist, the psilocybin metabolite psilocin directly and indirectly affects various brain cortical and subcortical areas and alters brain network dynamics Precisely how the enduring therapeutically relevant psilocybin effects are reflected in long-term alteration of cortical networks or other neuroplastic changes remains to be established.","When administered under psychologically supportive, double-blind conditions, a single dose of psilocybin produced substantial and enduring decreases in depressed mood and anxiety along with increases in quality of life and decreases in death anxiety in patients with a life-threatening cancer diagnosis. Ratings by patients themselves, clinicians, and community observers suggested these effects endured at least 6 months. The overall rate of clinical response at 6 months on clinician-rated depression and anxiety was 78% and 83%, respectively. A multisite study in a larger and more diverse patient population should be conducted to establish the generality and safety of psilocybin treatment of psychological distress associated with life-threatening cancer."
2,10.1001/archgenpsychiatry.2010.116,"The initial goals of this research project were to establish feasibility and safety for a hallucinogen treatment model in patients with advanced-stage cancer and anxiety. Following discussion with federal and state regulatory agencies as well as hospital institutional review board and research committees, a modest 0.2-mg/kg psilocybin dose was chosen. Although not comparable to higher doses of hallucinogens administered in the past to severely ill patients, the dose used here was still believed capable of inducing an alteration of consciousness with potential therapeutic benefit while optimizing patient safety. Determining safe parameters with this novel treatment paradigm is critical to establishing a strong foundation for this field of study that would allow for future investigations. Consistent with previous research, we found no untoward cardiovascular sequelae in our subject population.19 Minor HR and BP elevations after psilocybin administration were evidence only of a mild sympathomimetic effect. Holter monitoring did not identify increased cardiac arrhythmias in comparison with niacin placebo, even in subjects who presented with some baseline cardiac arrhythmia. Niacin may acutely lower BP through vasodilation35 but had minimal effects on BP and HR in our subjects, except for a reduction in diastolic BP that was noted 1 hour after administration of niacin. This transient effect may have contributed to our detection of a significant psilocybin effect at that time but cannot explain the significant effects of psilocybin over the subsequent intervals because the initial niacin-induced reduction of diastolic BP did not persist. We also observed no adverse psychological effects from the treatment. All subjects tolerated the treatment sessions well, with no indication of severe anxiety or a “bad trip.” The fact that psilocybin produced only modest effects on the anxious ego dissolution scale of the 5D-ASC confirmed this conclusion. When hallucinogens were administered to patients with terminal cancer in the 1960s and early 1970s, the occurrence of a profound psychospiritual experience was correlated with therapeutic outcome.10,12 Such transcendent states of consciousness are usually associated with higher doses of hallucinogens, so our expectation of demonstrating efficacy was limited.21 Common themes reported by subjects included examining how their illness had impacted their lives, relationships with family and close friends, and sense of ontological security. In addition, subjects reported powerful empathic cathexis to close friends and family members and examined how they wished to address their limited life expectancy. In monthly follow-up discussions, subjects reflected on insights and new perspectives gained during their psilocybin treatment. However, the frequency of these reports was not quantified. Although past researchers reported more pronounced therapeutic effects with a higher-dose model, even the lower dose of psilocybin used in the current study gave some indication of therapeutic benefit in quantitative psychological evaluations. In particular, we found that the STAI trait anxiety subscale demonstrated a sustained reduction in anxiety that reached significance at the 1- and 3-month points after treatment. This reduction might reflect a reduced level of stress and anxiety over time. Although the state anxiety on the STAI showed a modest elevation at 6 months, the change was not statistically significant and might have resulted from the deteriorating medical status of most subjects over time. Mood also improved for 2 weeks after treatment with psilocybin, with sustained improvement on the BDI reaching significance at the 6-month follow-up point. The POMS scores also reflected improved mood 2 weeks after receiving psilocybin. Although not statistically significant, there was a trend toward positive outcome. With a larger cohort of subjects and use of a higher dose of psilocybin, it seems possible that significant results would be obtained on these measures. Compared with placebo sessions, POMS scores were elevated in subjects immediately prior to psilocybin administration. The reasons for this difference in POMS scores 1 day before administration are not entirely clear. Subject expectations were unlikely to have played a role in the elevation of the POMS scores on the day before treatment because the elevation occurred regardless of treatment order. The most likely explanation for the elevation of POMS scores prior to treatment with psilocybin may be that subject randomization was not complete with regard to this instrument. Nonetheless, POMS scores declined after administration of psilocybin in 11 of 12 subjects, suggesting that psilocybin produces mood-elevating effects that persist after the acute effects of the drug. Another focus of the study was the effect of a 0.2-mg/kg psilocybin dose on somatic symptoms, particularly pain perception. In contrast to previous investigations, we did not find robust reductions in pain perception or lessened need for narcotic pain medication. In the 2 weeks following experimental treatment sessions, several subjects reported lessened pain, whereas others did not. There was no apparent difference between subjects treated with psilocybin and those treated with placebo (data not shown). Although this modest dose of psilocybin was not observed to impact pain, given the impressive reports of earlier researchers,6 this measure would certainly be indicated for study with higher doses. Although we used a within-subject, double-blind, placebo-controlled design, the drug order was almost always apparent to subjects and investigators whether the treatment was psilocybin or placebo. In fact, one consistent subject critique of the study was that the placebo sessions were perceived as far less worthwhile than those with psilocybin. Many of the subjects suggested that future protocols provide the opportunity for a second psilocybin session several weeks after the first. The general consensus among subjects was that a follow-up experience with psilocybin would reinforce and extend the perceived therapeutic effects of the initial session. Future studies also will need to address the issue of controlling for a placebo effect that might otherwise be attributed to the active treatment. Given the subjects' grave prognosis and limited life expectancy, we decided to provide all subjects with an opportunity to experience the experimental medicine and to serve as their own control. Although we believed that to be the ethical course to take, given the life circumstances subjects were encountering, the protocol design contains some inherent limitations. A better experimental design might incorporate an independent control group, receiving only either placebo treatment or a conventional psychopharmacological intervention. Although there is no question that the extensive attention paid to the subjects influenced outcomes, the unique qualities of the psilocybin experience in facilitating strong therapeutic bonds and ameliorating underlying psychological demoralization are important factors worthy of further exploration. Another limitation of this study was variability in the extent of contact with subjects after treatment. A minimum contact of 1 hour monthly was established, but variability in additional ad hoc communication depended on the needs and wishes of the subjects, some of whom were near death compared with others who were more functional. Despite the limitations, this study demonstrates that the careful and controlled use of psilocybin may provide an alternative model for the treatment of conditions that are often minimally responsive to conventional therapies, including the profound existential anxiety and despair that often accompany advanced-stage cancers. A recent review from the psilocybin research group at Johns Hopkins University describes the critical components necessary for ensuring subject safety in hallucinogen research.36 Taking into account these essential provisions for optimizing safety as well as adhering to strict ethical standards of conduct for treatment facilitators, the results provided herein indicate the safety and promise of continued investigations into the range of medical effects of hallucinogenic compounds such as psilocybin.",
3,10.1124/pr.115.011478,"Dr. Albert Hofmann, the natural products chemist who accidently discovered the effects of LSD in 1943 while working at the Sandoz Laboratories in Basel, Switzerland, wrote an autobiographical account of his discovery titled LSD: My Problem Child (Hofmann, 1979b). In his book, Hofmann talks about the potential of LSD, which he had hoped would be a promising new tool for psychiatry, but also expresses dismay at the social turbulence that ensued when “LSD was swept up in the huge wave of an inebriant mania that began to spread over the Western world, above all the United States…” (Hofmann, 1979b). Hofmann died in 2008 at the age of 102 years; but in his later years, he was delighted to see that real science had begun to take a thorough approach to unraveling the psychopharmacological mysteries of LSD, which he had always believed would eventually prove to be a miracle drug for psychiatry.With that in mind, if the positive therapeutic effects of psychedelics continue to be validated by additional well designed clinical studies, it opens up a whole new dimension of medical research. If psilocybin or LSD can acutely abolish depression or anxiety after one or only a few treatments, the question must be asked, “How does that occur?” There are many who believe that such improvement must be related to neurochemical effects, or neuroadaptation, and refuse to believe that the mystical experience may be relevant. Yet both modern and older studies consistently find that those who experience the most profound mystical experiences invariably receive the greatest symptom improvement. Of course, as reductionists, it is understood that the mystical experience must have neurochemical correlates. Even so, understanding what they are, how and why they occur, and how they lead to therapeutic improvement should shed light on the underlying deficits in brain function that lead to these disorders in the first place. Before-and-after brain imaging studies of patients with depression, anxiety, or addictive disorders will show how brain connectivity has changed as a result of psychedelic treatment. To understand these disorders at the present time with standard state-of-the-art approaches involves a sort of “fishing expedition,” searching for biomarkers that might be clues to the basis of the underlying disorder. Genome-wide association studies plow through many thousands or hundreds of thousands of genes, searching for candidates that might be the underlying causes of affective disorders. One generally cannot do prospective studies, to compare the brain function of the normal patient prior to the onset of his or her disease, and then examine it again after therapeutic improvement. Rather, one begins with a patient who is already sick, and then if therapeutic improvement occurs, usually over a long period of time, one tries to understand how it happened. By contrast, some of the recent treatments of anxiety and depression with psilocybin or LSD are so dramatic, and happen so quickly, that there must be some overt measureable changes in brain function or connectivity that correlate with therapeutic improvement. Learning what these are is the next big challenge, a process that promises to completely revolutionize the way we approach discovering better treatments for a host of human psychiatric disorders.Considering the most recent scientific and clinical developments in understanding the actions of psychedelics, a statement made in 1980 by Dr. Stanislav Grof seems particularly relevant today: “It does not seem to be an exaggeration to say that psychedelics, used responsibly and with proper caution, would be for psychiatry what the microscope is for biology and medicine or the telescope is for astronomy. These tools make it possible to study important processes that under normal circumstances are not available for direct observation” (Grof, 1980).",
4,10.1016/S2215-0366(16)30065-7,"In this open-label, single-arm pilot study, we sought to examine the feasibility of administering psilocybin to patients with treatment-resistant depression as a prelude to a larger randomised controlled trial. Our results support the view that, done with appropriate safeguards (eg, careful screening and adequate therapeutic support), psilocybin can be safely administered to this patient group.Because this was a small-scale feasibility study with an open-label design, strong inferences cannot be made about the treatment's therapeutic efficacy. However, the data do suggest that further research is warranted. The response rate to psilocybin was 67% (n=8) at 1 week after treatment (HAM-D and BDI), and seven of these eight patients also met criteria for remission. Moreover, 58% (n=7) of the patients maintained their response for 3 months, and 42% (n=5) remained in remission. It is also worth noting that psilocybin has a favourable toxicity profile and is not associated with compulsive drug-seeking behaviours in animals or human beings. The side-effects that we noted were minor, and expected in light of previous studies of psilocybin.Spontaneous recovery in refractory depression is rare, and many of the patients in the present study reported having depression for much of their adult lives (mean estimated illness duration 17·8 years [SD 8]). Key questions for future research therefore should address why the therapeutic effect observed in the present study is so large, and if it can be replicated when tighter experimental controls are introduced. Because the treatment in our study consisted of not just two psilocybin administrations but also psychological support before, during, and after these sessions, as well as a positive therapeutic environment for the sessions, the relative effects of these factors need to be determined, which can only be done by conducting further trials with appropriate control conditions. A logical next step would be to carry out a placebo-controlled randomised trial in which the level of therapist contact is consistent between conditions. This would enable any between-group differences in clinical outcomes to be attributed to psilocybin rather than the psychological support provided. However, a positive interaction between these variables seems likely, and inert placebo-based blinds are known to be ineffective in studies involving conspicuous experimental interventions, because patients can easily discern whether they are in the active condition or not. Use of an active placebo for the control condition might therefore be worth considering. Additionally, randomised comparative efficacy trials (eg, with an optional crossover component) incorporating another treatment for refractory depression (eg, ketamine infusion) could also be explored. The magnitude and persistence of the antidepressant effects observed here are not incongruent with what has been observed previously with psilocybin in chronic psychiatric conditions. For example, 80% of long-term heavy tobacco smokers demonstrated abstinence from smoking 6 months after two treatment sessions with psilocybin. 18 Alcohol-dependent patients demonstrated significantly reduced drinking behaviours over 8 months after one or two psilocybin sessions. 19 Significantly decreased anxiety and depression scores were observed 3 and 6 months after a single dose of psilocybin in patients with anxiety related to end-stage cancer, 15 and improvements in wellbeing lasting for more than 1 year were observed in healthy individuals given a single dose of psilocybin. 8 Rapid and enduring decreases in depressive symptoms were also recently found in a small-scale feasibility trial involving the psychedelic brew, ayahuasca. It is important to consider the limitations of this pilot study; for example, although all patients showed some clinical improvements for at least 3 weeks after treatment, and no serious or unexpected adverse reactions were observed, enduring improvements beyond 3 weeks were not observed universally, and five of the 12 patients showed a degree of relapse at 3 months. One should be cautious of the potential for inflated effect sizes in early trials, particularly when the sample size is small. That all patients showed some improvement in their depressive symptoms for up to 3 weeks after treatment could be suggestive of an expectancy bias. It may also be relevant that most patients in this trial were self-referring and, thus, actively sought this treatment. Psychedelics are known to promote suggestibility, 28 which might have further enhanced positive outcomes. Future double-blind randomised controlled trials could address the role of expectancy and suggestibility by measuring and controlling these variables. For example, patients could be asked about their pre-treatment expectations, suggestions could be controlled between conditions, and outcomes from self-referred patients could be compared with those from patients referred via clinicians. From a more pragmatic perspective, if expectancy or suggestibility are found to be influential in the context of psychedelic therapy, they could be treated as exploitable components of the treatment model rather than confounding variables. Serotonergic antidepressants have been found to down-regulate the primary receptor target of psilocybin (the 5-HT 2A receptor) and attenuated subjective responses to psychedelics have previously been reported in individuals chronically medicated with serotonergic antidepressants. 29 Thus, patients may be required to withdraw from concurrent antidepressant medication before receiving psilocybin and this should only ever be done with care. In conclusion, we sought to assess the safety and tolerability of psilocybin plus psychological support in patients with unipolar treatment-resistant depression. Our findings support the feasibility of this approach and the magnitude and duration of the post-treatment reductions in symptom severity motivate further controlled research. Psilocybin has a novel pharmacological action in comparison with currently available treatments for depression (ie, 5-HT 2A receptor agonism) and thus could constitute a useful addition to available therapies for the treatment of depression.",
