,Authors,Author Full Names,Article Title,Source Title,Language,Document Type,Author Keywords,Keywords Plus,Abstract,Addresses,Reprint Addresses,Email Addresses,Researcher Ids,ORCIDs,Funding Orgs,Funding Text,Cited References,Cited Reference Count,"Times Cited, WoS Core","Times Cited, All Databases",180 Day Usage Count,Since 2013 Usage Count,Publisher,Publisher City,Publisher Address,ISSN,eISSN,ISBN,Journal Abbreviation,Journal ISO Abbreviation,Publication Date,Publication Year,Volume,Issue,DOI,Book DOI,Early Access Date,WoS Categories,Research Areas,IDS Number,UT (Unique WOS ID),Pubmed Id,Open Access Designations,Highly Cited Status,Hot Paper Status,Date of Export,Reason for exclusion ,,Excluded from cohort 
1,"Vollenweider, FX; Kometer, M","Vollenweider, Franz X.; Kometer, Michael",OPINION The neurobiology of psychedelic drugs: implications for the treatment of mood disorders,NATURE REVIEWS NEUROSCIENCE,English,Article,,MEDIAL PREFRONTAL CORTEX; LYSERGIC-ACID DIETHYLAMIDE; POSITRON-EMISSION-TOMOGRAPHY; D-ASPARTATE ANTAGONIST; DORSAL RAPHE NUCLEUS; RAPID ANTIDEPRESSANT RESPONSE; MYSTICAL-TYPE EXPERIENCES; 5-HT2A RECEPTOR FUNCTION; MAJOR DEPRESSION; ANTIPSYCHOTIC-DRUGS,"After a pause of nearly 40 years in research into the effects of psychedelic drugs, recent advances in our understanding of the neurobiology of psychedelics, such as lysergic acid diethylamide (LSD), psilocybin and ketamine have led to renewed interest in the clinical potential of psychedelics in the treatment of various psychiatric disorders. Recent behavioural and neuroimaging data show that psychedelics modulate neural circuits that have been implicated in mood and affective disorders, and can reduce the clinical symptoms of these disorders. These findings raise the possibility that research into psychedelics might identify novel therapeutic mechanisms and approaches that are based on glutamate-driven neuroplasticity.","[Vollenweider, Franz X.; Kometer, Michael] Univ Hosp Psychiat, Neuropsychopharmacol & Brain Imaging Res Unit, Zurich, Switzerland; [Vollenweider, Franz X.] Univ Zurich, Sch Med, CH-8006 Zurich, Switzerland","Vollenweider, FX (corresponding author), Univ Hosp Psychiat, Neuropsychopharmacol & Brain Imaging Res Unit, Zurich, Switzerland.",vollen@bll.uzh.ch,,,Swiss Neuromatrix Foundation; Heffter Research Institute,"The authors would like to acknowledge the financial support of the Swiss Neuromatrix Foundation (to F. X. V. and M. K.), and of the Heffter Research Institute (to F. X. V.). The authors thank D. Nichols for critical comments on the manuscript.",,148,314,315,5,187,NATURE PUBLISHING GROUP,LONDON,"MACMILLAN BUILDING, 4 CRINAN ST, LONDON N1 9XW, ENGLAND",1471-003X,1471-0048,,NAT REV NEUROSCI,Nat. Rev. Neurosci.,SEP,2010,11,9,10.1038/nrn2884,,,Neurosciences,Neurosciences & Neurology,641JW,WOS:000281122500012,20717121,,,,44551,Not open content ,,TCN
2,"Bruchas, MR; Chavkin, C","Bruchas, Michael R.; Chavkin, Charles",Kinase cascades and ligand-directed signaling at the kappa opioid receptor,PSYCHOPHARMACOLOGY,English,Review,Kappa opioid receptor; Dynorphin; Kinase; MAPK; GPCR; Ligand-directed signaling; p38; ERK 1/2; JNK; Relapse; Stress; Opioid; Arrestin; Depression; Addiction; Therapeutics,"ACTIVATED PROTEIN-KINASE; N-TERMINAL KINASE; INDUCED BEHAVIORAL-RESPONSES; BETA-ARRESTIN; COUPLED RECEPTORS; SALVINORIN-A; C-JUN; U50,488H-INDUCED INTERNALIZATION; DIFFERENTIAL REGULATION; INTRACELLULAR CALCIUM","The dynorphin/kappa opioid receptor (KOR) system has been implicated as a critical component of the stress response. Stress-induced activation of dynorphin-KOR is well known to produce analgesia, and more recently, it has been implicated as a mediator of stress-induced responses including anxiety, depression, and reinstatement of drug seeking. Drugs selectively targeting specific KOR signaling pathways may prove potentially useful as therapeutic treatments for mood and addiction disorders. KOR is a member of the seven transmembrane spanning (7TM) G-protein coupled receptor (GPCR) superfamily. KOR activation of pertussis toxin-sensitive G proteins leads to G alpha i/o inhibition of adenylyl cyclase production of cAMP and releases G beta gamma, which modulates the conductances of Ca+2 and K+ channels. In addition, KOR agonists activate kinase cascades including G-protein coupled Receptor Kinases (GRK) and members of the mitogen-activated protein kinase (MAPK) family: ERK1/2, p38 and JNK. Recent pharmacological data suggests that GPCRs exist as dynamic, multi-conformational protein complexes that can be directed by specific ligands towards distinct signaling pathways. Ligand-induced conformations of KOR that evoke beta-arrestin-dependent p38 MAPK activation result in aversion; whereas ligand-induced conformations that activate JNK without activating arrestin produce long-lasting inactivation of KOR signaling. In this review, we discuss the current status of KOR signal transduction research and the data that support two novel hypotheses: (1) KOR selective partial agonists that do not efficiently activate p38 MAPK may be useful analgesics without producing the dysphoric or hallucinogenic effects of selective, highly efficacious KOR agonists and (2) KOR antagonists that do not activate JNK may be effective short-acting drugs that may promote stress-resilience.","[Bruchas, Michael R.; Chavkin, Charles] Univ Washington, Dept Pharmacol, Seattle, WA 98195 USA","Chavkin, C (corresponding author), Univ Washington, Dept Pharmacol, Seattle, WA 98195 USA.",cchavkin@u.washington.edu,"Chavkin, Charles/G-2797-2010; Bruchas, Michael/G-7616-2012",,"National Institute on Drug Abuse U.S. Public Health ServiceUnited States Department of Health & Human ServicesNational Institutes of Health (NIH) - USANIH National Institute on Drug Abuse (NIDA)United States Public Health Service [DA25970, DA20570, DA25182]; Hope for Depression Research Foundation; NATIONAL INSTITUTE ON DRUG ABUSEUnited States Department of Health & Human ServicesNational Institutes of Health (NIH) - USANIH National Institute on Drug Abuse (NIDA)European Commission [R21DA025970, K99DA025182, K05DA020570] Funding Source: NIH RePORTER","This work was supported by National Institute on Drug Abuse U.S. Public Health Service Grants DA25970, DA20570, and DA25182 and the Hope for Depression Research Foundation.",,109,180,189,0,26,SPRINGER,NEW YORK,"233 SPRING ST, NEW YORK, NY 10013 USA",0033-3158,1432-2072,,PSYCHOPHARMACOLOGY,Psychopharmacology,JUN,2010,210,2,10.1007/s00213-010-1806-y,,,Neurosciences; Pharmacology & Pharmacy; Psychiatry,Neurosciences & Neurology; Pharmacology & Pharmacy; Psychiatry,592XW,WOS:000277416300004,20401607,Green Accepted,,,21/12/21,Not classic psychedelic ,,TCN
3,"Zhang, GL; Stackman, RW","Zhang, Gongliang; Stackman, Robert W., Jr.",The role of serotonin 5-HT2A receptors in memory and cognition,FRONTIERS IN PHARMACOLOGY,English,Review,serotonin; 5-HT2A receptor; learning; memory; cognition,FUNCTIONAL GENETIC-VARIATION; CENTRAL-NERVOUS-SYSTEM; PROTEIN-KINASE-C; CONTEXTUAL FEAR; 5-HYDROXYTRYPTAMINE(2A) RECEPTOR; PREFRONTAL CORTEX; OBJECT RECOGNITION; ALZHEIMERS-DISEASE; MOLECULAR-BIOLOGY; WORKING-MEMORY,"Serotonin 5-HT2A receptors (5-HT(2A)R5) are widely distributed in the central nervous system, especially in brain region essential for learning and cognition. In addition to endogenous 5-HT, several hallucinogens, antipsychotics, and antidepressants function by targeting 5-HT(2A)R5. Preclinical studies show that 5-HT2AR antagonists have antipsychotic and antidepressant properties, whereas agonist ligands possess cognition-enhancing and hallucinogenic properties. Abnormal 5-HT2AR activity is associated with a number of psychiatric disorders and conditions, including depression, schizophrenia, and drug addiction. In addition to its traditional activity as a G protein-coupled receptor (GPCR), recent studies have defined novel operations of 5-HT(2A)R5. Here we review progress in the (1) receptor anatomy and biology: distribution, signaling, polymerization and allosteric modulation; and (2) receptor functions: learning and memory, hallucination and spatial cognition, and mental disorders. Based on the recent progress in basic research on the 5-HT2AR, it appears that post-training 5-HT2AR activation enhances non-spatial memory consolidation, while pre-training 5-HT2AR activation facilitates fear extinction. Further, the potential influence that 5-HT2AR-elicited visual hallucinations may have on visual cue (i.e., landmark) guided spatial cognition is discussed. We conclude that the development of selective 5-HT2AR modulators to target distinct signaling pathways and neural circuits represents a new possibility for treating emotional, neuropsychiatric, and neurodegenerative disorders.","[Zhang, Gongliang] Anhui Med Univ, Coll Basic Med, Hefei 230032, Anhui, Peoples R China; [Zhang, Gongliang] Florida Atlantic Univ, Charles E Schmidt Coll Sci, Dept Biol, Jupiter, FL 33458 USA; [Zhang, Gongliang; Stackman, Robert W., Jr.] Florida Atlantic Univ, Jupiter Life Sci Initiat, Jupiter, FL 33458 USA; [Stackman, Robert W., Jr.] Florida Atlantic Univ, Charles E Schmidt Coll Sci, Dept Psychol, Jupiter, FL 33458 USA","Zhang, GL (corresponding author), Anhui Med Univ, Coll Basic Med, 81 Meishan Rd, Hefei 230032, Anhui, Peoples R China.",gzhang@fau.edu; rstackma@fau.edu,"Stackman, Robert W./E-8685-2019","Stackman Jr, Robert/0000-0002-5950-046X","NSFNational Science Foundation (NSF) [IBN 0630522]; NIHUnited States Department of Health & Human ServicesNational Institutes of Health (NIH) - USA [MH 086591]; Researcher of the Year award from the Division of Research at Florida Atlantic University; National Natural Science Foundation general projects from China [81271217, 81471161]; Ph.D. Start Fund from Anhui Medical University [XJ201405]; NATIONAL INSTITUTE OF MENTAL HEALTHUnited States Department of Health & Human ServicesNational Institutes of Health (NIH) - USANIH National Institute of Mental Health (NIMH) [R01MH086591] Funding Source: NIH RePORTER","This project was supported by the NSF (IBN 0630522) and NIH (MH 086591) and a Researcher of the Year award from the Division of Research at Florida Atlantic University to RS and National Natural Science Foundation general projects from China (81271217, 81471161), Ph.D. Start Fund from Anhui Medical University (XJ201405) to GZ.",,186,118,123,3,36,FRONTIERS MEDIA SA,LAUSANNE,"AVENUE DU TRIBUNAL FEDERAL 34, LAUSANNE, CH-1015, SWITZERLAND",1663-9812,,,FRONT PHARMACOL,Front. Pharmacol.,Oct-06,2015,6,,10.3389/fphar.2015.00225,,,Pharmacology & Pharmacy,Pharmacology & Pharmacy,CX9TS,WOS:000366049100001,26500553,"gold, Green Published",,,21/12/21,Not psychedelic study ,,TCN
4,"Simoni, JM; Huh, D; Wilson, IB; Shen, J; Goggin, K; Reynolds, NR; Remien, RH; Rosen, MI; Bangsberg, DR; Liu, HH","Simoni, Jane M.; Huh, David; Wilson, Ira B.; Shen, Jie; Goggin, Kathy; Reynolds, Nancy R.; Remien, Robert H.; Rosen, Marc I.; Bangsberg, David R.; Liu, Honghu",Racial/Ethnic Disparities in ART Adherence in the United States: Findings From the MACH14 Study,JAIDS-JOURNAL OF ACQUIRED IMMUNE DEFICIENCY SYNDROMES,English,Article,HIV/AIDS; race/ethnicity; antiretroviral treatment; medication adherence,ACTIVE ANTIRETROVIRAL THERAPY; DRUG-USE; HEALTH LITERACY; DEPRESSION; SAMPLE; MEN; DISCRIMINATION; ACCESS; AIDS; RACE/ETHNICITY,"Background: Minority race/ethnicity is generally associated with antiretroviral therapy nonadherence in US-based studies. Limitations of the existing literature include small samples, subjective adherence measures, and inadequate control for potential confounders such as mental health and substance use, which have been consistently associated with poorer adherence. Methods: Individual-level data were pooled from 13 US-based studies employing electronic drug monitoring to assess adherence. Adherence was operationalized as percent of prescribed doses taken from the first 12 (monthly) waves of data in each study. Depression symptoms were aggregated from several widely used assessments, and substance use was operationalized as any use of cocaine/stimulants, heroin/opiates, ecstasy, hallucinogens, or sedatives in the 30-365 days preceding baseline. Results: The final analytic sample of 1809 participants ranged in age from 18 to 72 years and was 67% male. Participants were 53% African American, 14% Latino, and 34% White. In a logistic regression adjusting for age, gender, income, education, and site, race/ethnicity was significantly associated with adherence (P, 0.001) and persisted in a model that also controlled for depression and substance use (P < 0.001), with African Americans having significantly lower adherence than Latinos [odds ratio (OR) = 0.72, P = 0.04] and whites (OR = 0.60, P < 0.001). Adherence did not differ between whites and Latinos (OR = 0.84, P = 0.27). Conclusions: Racial/ethnic differences in demographics, depression, and substance abuse do not explain the lower level of antiretroviral therapy adherence in African Americans observed in our sample. Further research is needed to explain the persistent disparity and might examine factors such as mistrust of providers, health literacy, and inequities in the health care system.","[Simoni, Jane M.; Huh, David; Bangsberg, David R.] Univ Washington, Dept Psychol, Seattle, WA 98195 USA; [Wilson, Ira B.] Brown Univ, Alpert Med Sch, Dept Hlth Serv Policy & Practice, Providence, RI 02912 USA; [Shen, Jie] Univ Calif Los Angeles, Sch Dent, Div Publ Hlth & Community Dent, Los Angeles, CA 90024 USA; [Goggin, Kathy] Univ Missouri, Dept Psychol, Kansas City, MO 64110 USA; [Reynolds, Nancy R.] Yale Univ, Sch Nursing, New Haven, CT 06536 USA; [Remien, Robert H.] Columbia Univ, Coll Phys & Surg, New York, NY 10027 USA; [Rosen, Marc I.] Yale Univ, Sch Med, West Haven, CT 06516 USA; [Bangsberg, David R.] Harvard Univ, Sch Med, Massachusetts Gen Hosp, Div Infect Dis, Cambridge, MA 02138 USA; [Liu, Honghu] Univ Calif Los Angeles, Dept Med, Div Publ Hlth & Community Dent, Los Angeles, CA 90024 USA; [Liu, Honghu] Univ Calif Los Angeles, Dept Biostat, Los Angeles, CA USA","Simoni, JM (corresponding author), Univ Washington, Dept Psychol, Box 351525, Seattle, WA 98195 USA.",jsimoni@uw.edu,"Wilson, Ira/F-9190-2016","Wilson, Ira/0000-0002-0246-738X; Simoni, Jane/0000-0002-8711-1576; Shen, Jie/0000-0003-2187-2273; Huh, David/0000-0002-6357-4883","National Institute of Mental Health (NIMH), Office on AIDS [R01MH078773];  [R01DA11869];  [R01MH54907];  [R01NR04749];  [R01MH68197];  [R01DA13826];  [K23MH01862];  [R01MH01584];  [R01AI41413];  [R01 MH61173];  [NIH/NIAID AI38858];  [AI069419];  [K02DA017277];  [R01DA15215];  [NIMH P01MH49548];  [R01MH58986];  [R01MH61695];  [CC99-SD003];  [CC02-SD-003];  [R01DA015679]; NATIONAL INSTITUTE OF ALLERGY AND INFECTIOUS DISEASESUnited States Department of Health & Human ServicesNational Institutes of Health (NIH) - USANIH National Institute of Allergy & Infectious Diseases (NIAID) [U01AI069419, R01AI041413, U01AI038858, P30AI050410, UM1AI069419, P30AI027757] Funding Source: NIH RePORTER; NATIONAL INSTITUTE OF MENTAL HEALTHUnited States Department of Health & Human ServicesNational Institutes of Health (NIH) - USANIH National Institute of Mental Health (NIMH) [K23MH001862, K24MH092242, R01MH058986, R01MH054907, P01MH049548, R01MH061695, R01MH061173, R01MH078773, R01MH068197, K24MH093243, K08MH001584, P30MH043520, R01MH083595] Funding Source: NIH RePORTER; NATIONAL INSTITUTE OF NURSING RESEARCHUnited States Department of Health & Human ServicesNational Institutes of Health (NIH) - USANIH National Institute of Nursing Research (NINR) [R01NR004749] Funding Source: NIH RePORTER; NATIONAL INSTITUTE ON DRUG ABUSEUnited States Department of Health & Human ServicesNational Institutes of Health (NIH) - USANIH National Institute on Drug Abuse (NIDA)European Commission [R01DA011869, K02DA017277, R01DA015679, R01DA015215, R01DA013826] Funding Source: NIH RePORTER","Supported by the multisite adherence collaboration in HIV (MACH14) grant R01MH078773 from the National Institute of Mental Health (NIMH), Office on AIDS. The original grants of individual participating studies are: R01DA11869, R01MH54907, R01NR04749, R01NR04749, R01MH68197, R01DA13826, K23MH01862, R01MH01584, R01AI41413, R01 MH61173, NIH/NIAID AI38858, AI069419, K02DA017277, R01DA15215, NIMH P01MH49548, R01MH58986, R01MH61695, CC99-SD003, CC02-SD-003, and R01DA015679.",,43,107,107,2,26,LIPPINCOTT WILLIAMS & WILKINS,PHILADELPHIA,"TWO COMMERCE SQ, 2001 MARKET ST, PHILADELPHIA, PA 19103 USA",1525-4135,1077-9450,,JAIDS-J ACQ IMM DEF,JAIDS,Aug-15,2012,60,5,10.1097/QAI.0b013e31825db0bd,,,Immunology; Infectious Diseases,Immunology; Infectious Diseases,981TV,WOS:000306994500006,22595873,Green Accepted,,,21/12/21,Not psychedelic study ,,TCN
5,"Schankin, CJ; Maniyar, FH; Digre, KB; Goadsby, PJ","Schankin, Christoph J.; Maniyar, Farooq H.; Digre, Kathleen B.; Goadsby, Peter J.",'Visual snow' - a disorder distinct from persistent migraine aura,BRAIN,English,Article,visual snow; persistent migraine aura; flashback; migraine; positive persistent visual disturbance,PALINOPSIA; TINNITUS; CONTRAST; CORTEX,"Patients with 'visual snow' experience dots in their visual field resembling analogue TV noise. By studying a large cohort of patients, Schankin et al. reveal that visual snow is a unique syndrome distinct from migraine aura, despite its frequent comorbidity with migraine. Existing therapies are largely ineffective against visual snow.Patients with 'visual snow' report continuous tiny dots in the entire visual field similar to the noise of an analogue television. As they frequently have migraine as a comorbidity with ophthalmological, neurological and radiological studies being normal, they are offered various diagnoses, including persistent migraine aura, post-hallucinogen flashback, or psychogenic disorder. Our aim was to study patients with 'visual snow' to characterize the phenotype. A three-step approach was followed: (i) a chart review of patients referred to us identified 22 patients with 'visual snow'. Fifteen had additional visual symptoms, and 20 patients had comorbid migraine, five with aura; (ii) to identify systematically additional visual symptoms, an internet survey (n = 275) of self-assessed 'visual snow' subjects done by Eye On Vision Foundation was analysed. In two random samples from 235 complete data sets, the same eight additional visual symptoms were present in > 33% of patients: palinopsia (trailing and afterimages), entoptic phenomena (floaters, blue field entoptic phenomenon, spontaneous photopsia, self-light of the eye), photophobia, and nyctalopia (impaired night vision); and (iii) a prospective semi-structured telephone interview in a further 142 patients identified 78 (41 female) with confirmed 'visual snow' and normal ophthalmological exams. Of these, 72 had at least three of the additional visual symptoms from step (ii). One-quarter of patients had 'visual snow' as long as they could remember, whereas for the others the mean age of onset was 21 +/- 9 years. Thirty-two patients had constant visual symptoms, whereas the remainder experienced either progressive or stepwise worsening. Headache was the most frequent symptom associated with the beginning or a worsening of the visual disturbance (36%), whereas migraine aura (seven patients) and consumption of illicit drugs (five, no hallucinogens) were rare. Migraine (59%), migraine with aura (27%), anxiety and depression were common comorbidities over time. Eight patients had first degree relatives with visual snow. Clinical investigations were not contributory. Only a few treatment trials have been successful in individual patients. Our data suggest that 'visual snow' is a unique visual disturbance clinically distinct from migraine aura that can be disabling for patients. Migraine is a common concomitant although standard migraine treatments are often unhelpful. 'Visual snow' should be considered a distinct disorder and systematic studies of its clinical features, biology and treatment responses need to be commenced to begin to understand what has been an almost completely ignored problem.","[Schankin, Christoph J.; Maniyar, Farooq H.; Goadsby, Peter J.] Univ Calif San Francisco, Dept Neurol, Headache Grp, San Francisco, CA USA; [Schankin, Christoph J.; Maniyar, Farooq H.; Goadsby, Peter J.] Kings Coll London, NIHR Wellcome Trust Clin Res Facil, London WC2R 2LS, England; [Digre, Kathleen B.] Univ Utah, Dept Neurol, Moran Eye Ctr, Salt Lake City, UT USA","Goadsby, PJ (corresponding author), Kings Coll Hosp London, NIHR Wellcome Trust Clin Res Facil, London SE5 9PJ, England.",peter.goadsby@kcl.ac.uk,"Goadsby, Peter J/Z-1970-2019; Cusco, Xavier Garcia/S-7576-2019","Goadsby, Peter J/0000-0003-3260-5904; Cusco, Xavier Garcia/0000-0001-7199-6931","German Research FoundationGerman Research Foundation (DFG) [SCHA 1676/1-1]; Research to Prevent Blindness, Inc., New York, New York, USAResearch to Prevent Blindness (RPB)","C.J.S. was supported by the German Research Foundation [SCHA 1676/1-1]. K. B. D. was supported in part by an unrestricted grant from Research to Prevent Blindness, Inc., New York, New York, USA, to the Department of Ophthalmology and Visual Sciences, University of Utah.",,44,94,97,1,35,OXFORD UNIV PRESS,OXFORD,"GREAT CLARENDON ST, OXFORD OX2 6DP, ENGLAND",0006-8950,1460-2156,,BRAIN,Brain,MAY,2014,137,,10.1093/brain/awu050,,,Clinical Neurology; Neurosciences,Neurosciences & Neurology,AH6PK,WOS:000336252800020,24645145,Bronze,,,21/12/21,Not psychedelic study ,,TCN
6,"Schmid, CL; Bohn, LM","Schmid, Cullen L.; Bohn, Laura M.","Serotonin, But Not N-Methyltryptamines, Activates the Serotonin 2A Receptor Via a beta-Arrestin2/Src/Akt Signaling Complex In Vivo",JOURNAL OF NEUROSCIENCE,English,Article,,HEAD-TWITCH RESPONSE; BETA-ARRESTINS; 7-TRANSMEMBRANE RECEPTORS; FUNCTIONAL SELECTIVITY; 5-HYDROXYTRYPTAMINE (5-HT)(2A); PSYCHOTIC DISORDERS; PREFRONTAL CORTEX; 5-HT2C RECEPTORS; AGONIST; BEHAVIOR,"Hallucinogens mediate many of their psychoactive effects by activating serotonin 2A receptors (5-HT2AR). Although serotonin is the cognate endogenous neurotransmitter and is not considered hallucinogenic, metabolites of serotonin also have high affinity at 5-HT2AR and can induce hallucinations in humans. Here we report that serotonin differs from the psychoactive N-methyltryptamines by its ability to engage a beta-arrestin2-mediated signaling cascade in the frontal cortex. Serotonin and 5-hydroxy-L-tryptophan (5-HTP) induce a head-twitch response in wild-type (WT) mice that is a behavioral proxy for 5-HT2AR activation. The response in beta-arrestin2 knock-out (beta arr2-KO) mice is greatly attenuated until the doses are elevated, at which point, beta arr2-KO mice display a head-twitch response that can exceed that of WT mice. Direct administration of N-methyltryptamines also produces a greater response in beta arr2-KO mice. Moreover, the inhibition of N-methyltransferase blocks 5-HTP-induced head twitches in beta arr2-KO mice, indicating that N-methyltryptamines, rather than serotonin, primarily mediate this response. Biochemical studies demonstrate that serotonin stimulates Akt phosphorylation in the frontal cortex and in primary cortical neurons through the activation of a beta-arrestin2/phosphoinositide 3-kinase/Src/Akt cascade, whereas N-methyltryptamines do not. Furthermore, disruption of any of the components of this cascade prevents 5-HTP-induced, but not N-methyltryptamine-induced, head twitches. We propose that there is a bifurcation of 5-HT2AR signaling that is neurotransmitter and beta-arrestin2 dependent. This demonstration of agonist-directed 5-HT2AR signaling in vivo may significantly impact drug discovery efforts for the treatment of disorders wherein hallucinations are part of the etiology, such as schizophrenia, or manifest as side effects of treatment, such as depression.","[Schmid, Cullen L.; Bohn, Laura M.] Scripps Res Inst, Jupiter, FL 33458 USA; [Schmid, Cullen L.] Ohio State Univ, Neurosci Grad Studies Program, Columbus, OH 43210 USA","Bohn, LM (corresponding author), 130 Scripps Way,2A2, Jupiter, FL 33458 USA.",LBohn@scripps.edu,"Bohn, Laura M/A-7483-2014","Bohn, Laura M/0000-0002-6474-8179; Schmid Mason, Cullen/0000-0002-2882-1842",National Institute on Drug AbuseUnited States Department of Health & Human ServicesNational Institutes of Health (NIH) - USANIH National Institute on Drug Abuse (NIDA)European Commission [DA025158]; NATIONAL INSTITUTE ON DRUG ABUSEUnited States Department of Health & Human ServicesNational Institutes of Health (NIH) - USANIH National Institute on Drug Abuse (NIDA)European Commission [R01DA025158] Funding Source: NIH RePORTER,This work is funded by National Institute on Drug Abuse Grant DA025158 (L. M. B.). We acknowledge Dr. Robert J. Lefkowitz for providing the initial breeders for the beta-arrestin2-KO mouse line and for the A2CT antibody and Dr. Kenner Rice for providing the M100907 compound.,,77,92,92,0,15,SOC NEUROSCIENCE,WASHINGTON,"11 DUPONT CIRCLE, NW, STE 500, WASHINGTON, DC 20036 USA",0270-6474,,,J NEUROSCI,J. Neurosci.,Oct-06,2010,30,40,10.1523/JNEUROSCI.1665-10.2010,,,Neurosciences,Neurosciences & Neurology,659MQ,WOS:000282571000031,20926677,"Green Accepted, Bronze, Green Published",,,21/12/21,Not classic psychedelic ,,TCN
