11,"Abdolmaleky, HM; Nohesara, S; Ghadirivasfi, M; Lambert, AW; Ahmadkhaniha, H; Ozturk, S; Wong, CK; Shafa, R; Mostafavi, A; Thiagalingam, S","Abdolmaleky, Hamid Mostafavi; Nohesara, Shabnam; Ghadirivasfi, Mohammad; Lambert, Arthur W.; Ahmadkhaniha, Hamidreza; Ozturk, Sait; Wong, Chen Khuan; Shafa, Rahim; Mostafavi, Ashraf; Thiagalingam, Sam",DNA hypermethylation of serotonin transporter gene promoter in drug naive patients with schizophrenia,SCHIZOPHRENIA RESEARCH,English,Article,Serotonin transporter; DNA methylation; Brain; Saliva; Schizophrenia,MB-COMT PROMOTER; BIPOLAR DISORDER; T102C POLYMORPHISM; MAJOR DEPRESSION; RISK-FACTOR; METAANALYSIS; ASSOCIATION; HYPOMETHYLATION; MICE; NOREPINEPHRINE,"Introduction: Dysfunctional serotonin signaling has been linked to the pathogenesis of autism, obsessive compulsive disorder, mood disorders and schizophrenia. While the hypo-activity of serotonin signaling is involved in the pathogenesis of depression, anxiety and obsessive compulsive disorder; LSD, an agonist of serotonin type 2 receptor (5-HTR2A) induces psychosis. Therefore, anxiety and depressive disorders are treated by SSRIs which inhibit serotonin transporter (5-HTT) while psychotic disorders are controlled by drugs that block serotonin and/or dopamine receptors. Since genetic polymorphisms and epigenetic dysregulation of 5-HTT are involved in the pathogenesis of mental diseases, we analyzed DNA methylation of 5-HTT promoter in post-mortem brains and saliva samples of patients with schizophrenia (SCZ) and bipolar disorder (BD) to evaluate its potential application as a diagnostic and/or therapeutic biomarker in SCZ and BD. Methods: Whole genome DNA methylation profiling was performed for a total of 24 samples (including two saliva samples) using the Illumina 27 K (for 12 samples) and 450 K DNA methylation array platform(for another 12 samples), followed by bisulfite sequencing to identify candidate CpGs for further analysis. Quantitative methylation specific PCR (qMSP) was used to assess the degree of CpG methylation of 5-HTT promoter in 105 post-mortem brains (35 controls, 35 SCZ and 35 BD) and 100 saliva samples (30 controls, 30 SCZ, 20 BD and 20 first degree relatives of SCZ or BD). The U133 2.0 Plus Human Transcriptome array for a total of 30 post-mortem brain samples (each group 10) followed by quantitative real-time PCR was used to study 5-HTT expression in 105 post-mortem brain samples. Results: The qMSP analysis for 5-HTT promoter region showed DNA hypermethylation in post-mortem brain samples of SCZ patients (similar to 30%), particularly in drug free patients (similar to 60%, p = 0.04). Similarly, there was a trend for DNA hypermethylation in antipsychotic free BD patients (similar to 50%, p = 0.066). qMSP analysis of DNA extracted from the saliva samples also exhibited hypermethylation of 5-HTT promoter in patients with SCZ (similar to 30%, p = 0.039), which was more significant in drug naive SCZ patients (>50%, p = 0.0025). However, the difference was not significant between the controls and unaffected first degree relatives of patients with SCZ (p = 0.37) and versus patients using antipsychotic drugs (p = 0.2). The whole genome transcriptome analysis of post-mortem brain samples showed reduced expression of 5-HTT in SCZ compared to the control subjects (similar to 50%, p = 0.008), confirmed by quantitative real-time PCR analysis (similar to 40%, p = 0.035) which was more significant in drug free SCZ patients (similar to 70%, p = 0.022). Conclusion: A correlation between reduction in 5-HTT expression and DNA hypermethylation of the 5-HTT promoter in drug naive SCZ patients suggests that an epigenetically defined hypo-activity of 5-HTT may be linked to SCZ pathogenesis. Furthermore, this epigenetic mark in DNA extracted from saliva can be considered as one of the key determinants in a panel of diagnostic and/or therapeutic biomarkers for SCZ. (C) 2013 Elsevier B. V. All rights reserved.","[Abdolmaleky, Hamid Mostafavi; Lambert, Arthur W.; Ozturk, Sait; Wong, Chen Khuan; Thiagalingam, Sam] Boston Univ, Sch Med, Dept Med, Biomed Genet Sect, Boston, MA 02118 USA; [Abdolmaleky, Hamid Mostafavi; Lambert, Arthur W.; Ozturk, Sait; Wong, Chen Khuan; Thiagalingam, Sam] Boston Univ, Sch Med, Dept Genet & Genom, Boston, MA 02118 USA; [Thiagalingam, Sam] Boston Univ, Sch Med, Dept Pathol & Lab Med, Boston, MA 02118 USA; [Abdolmaleky, Hamid Mostafavi; Ozturk, Sait; Wong, Chen Khuan; Thiagalingam, Sam] Boston Univ, Sch Med, Genome Sci Inst, Boston, MA 02118 USA; [Nohesara, Shabnam; Ghadirivasfi, Mohammad; Ahmadkhaniha, Hamidreza] Iran Univ Med Sci, Dept Psychiat, Mental Hlth Res Ctr, Tehran, Iran; [Shafa, Rahim] Metrowest CNS Res Ctr, Natick, MA USA; [Mostafavi, Ashraf] Arian Salamat Counseling & Nursing Cervices Ctr, Tehran, Iran","Abdolmaleky, HM (corresponding author), Boston Univ, Sch Med, Dept Med, Biomed Genet Sect, Boston, MA 02118 USA.",,"Ahmadkhaniha, Hamidreza/N-5867-2018","Ahmadkhaniha, Hamidreza/0000-0003-0023-3544; Mostafavi Abdolmaleky, Hamid/0000-0002-8872-5174; Wong, Chen Khuan/0000-0001-9811-3334","Mental Health Research Center; TUMS; NARSAD Independent Investigator AwardNARSAD; CTSI, Boston University (NIH CTSA) [UL1-TR00157]; NATIONAL CENTER FOR ADVANCING TRANSLATIONAL SCIENCESUnited States Department of Health & Human ServicesNational Institutes of Health (NIH) - USANIH National Center for Advancing Translational Sciences (NCATS) [UL1TR000157] Funding Source: NIH RePORTER","This work was supported by a grant from the Mental Health Research Center, TUMS, NARSAD Independent Investigator Award to Dr. Sam Thiagalingam and CTSI, Boston University (NIH CTSA, UL1-TR00157).",,41,61,63,0,38,ELSEVIER SCIENCE BV,AMSTERDAM,"PO BOX 211, 1000 AE AMSTERDAM, NETHERLANDS",0920-9964,1573-2509,,SCHIZOPHR RES,Schizophr. Res.,FEB,2014,152,2-Mar,10.1016/j.schres.2013.12.007,,,Psychiatry,Psychiatry,296MF,WOS:000330188500008,24411530,Green Accepted,,,21/12/21,Schizophrenia study ,,TCN
12,"Lathem, TL; Nenes, A","Lathem, Terry L.; Nenes, Athanasios",Water Vapor Depletion in the DMT Continuous-Flow CCN Chamber: Effects on Supersaturation and Droplet Growth,AEROSOL SCIENCE AND TECHNOLOGY,English,Article,,CLOUD CONDENSATION NUCLEI; ANALYSIS-A METHOD; ACTIVATION KINETICS; BOUNDARY-LAYER; AEROSOL; PARTICLES; COUNTER,"The continuous-flow streamwise thermal-gradient cloud condensation nuclei counter (CFSTGC) is a commercially available instrument that is widely used for laboratory and field measurements of cloud condensation nuclei (CCN). All studies to date assume that the supersaturation profile generated in its growth chamber is not influenced by the condensation of water vapor upon the growing CCN. The validity of this assumption, however, has never been systematically explored. This work examines when water vapor depletion from CCN can have an important impact on supersaturation, measured CCN concentration, and droplet growth. A fully coupled numerical flow model of the instrument is used to simulate the water vapor supersaturation, temperature, velocity profiles, and CCN growth in the CFSTGC for a wide range of operation and CCN concentrations. Laboratory CCN activation experiments of polydisperse calibration aerosol (with a DMT CFSTGC operated in constant flow mode) are used to evaluate the simulations. The simulations and laboratory experiments are then generalized using a scaling analysis of the conditions that lead to supersaturation depletion. We find that CCN concentrations below 5000 cm(-3) (regardless of their activation kinetics or instrument operating conditions) do not decrease supersaturation and outlet droplet diameter by more than 10%. For larger CCN concentrations, a simple correction can be applied that addresses both the depression in supersaturation and droplet size.","[Lathem, Terry L.; Nenes, Athanasios] Georgia Inst Technol, Sch Earth & Atmospher Sci, Atlanta, GA 30332 USA; [Nenes, Athanasios] Georgia Inst Technol, Sch Chem & Biomol Engn, Atlanta, GA 30332 USA","Nenes, A (corresponding author), Georgia Inst Technol, Sch Earth & Atmospher Sci, Atlanta, GA 30332 USA.",athanasios.nenes@gatech.edu,,,NSF CAREERNational Science Foundation (NSF)NSF - Office of the Director (OD); NOAANational Oceanic Atmospheric Admin (NOAA) - USA; NSFNational Science Foundation (NSF); Georgia Institute of Technology,"We would like to thank R. Moore and A. Asa-Awuku for their comments that improved the manuscript. We acknowledge funding from NSF CAREER, NOAA, an NSF Graduate Student Fellowship and a Georgia Institute of Technology Presidential Scholarship.",,32,61,65,1,31,TAYLOR & FRANCIS INC,PHILADELPHIA,"325 CHESTNUT ST, SUITE 800, PHILADELPHIA, PA 19106 USA",0278-6826,,,AEROSOL SCI TECH,Aerosol Sci. Technol.,,2011,45,5,10.1080/02786826.2010.551146,,,"Engineering, Chemical; Engineering, Mechanical; Environmental Sciences; Meteorology & Atmospheric Sciences",Engineering; Environmental Sciences & Ecology; Meteorology & Atmospheric Sciences,720SI,WOS:000287300400002,,,,,21/12/21,Not psychedelic study ,,TCN
13,"Coleman, JA; Yang, DX; Zhao, ZY; Wen, PC; Yoshioka, C; Tajkhorshid, E; Gouaux, E","Coleman, Jonathan A.; Yang, Dongxue; Zhao, Zhiyu; Wen, Po-Chao; Yoshioka, Craig; Tajkhorshid, Emad; Gouaux, Eric",Serotonin transporter-ibogaine complexes illuminate mechanisms of inhibition and transport,NATURE,English,Article,,GENERAL FORCE-FIELD; X-RAY STRUCTURES; MOLECULAR-DYNAMICS; NEUROTRANSMITTER TRANSPORTERS; SOFTWARE NEWS; FACING STATE; BINDING; LEUT; VALIDATION; SITE,"The serotonin transporter (SERT) regulates neurotransmitter homeostasis through the sodium- and chloride-dependent recycling of serotonin into presynaptic neurons(1-3). Major depression and anxiety disorders are treated using selective serotonin reuptake inhibitors-small molecules that competitively block substrate binding and thereby prolong neurotransmitter action(2,4). The dopamine and noradrenaline transporters, together with SERT, are members of the neurotransmitter sodium symporter (NSS) family. The transport activities of NSSs can be inhibited or modulated by cocaine and amphetamines(2,3), and genetic variants of NSSs are associated with several neuropsychiatric disorders including attention deficit hyperactivity disorder, autism and bipolar disorder(2,5). Studies of bacterial NSS homologues-including LeuT-have shown how their transmembrane helices (TMs) undergo conformational changes during the transport cycle, exposing a central binding site to either side of the membrane(1,6-12). However, the conformational changes associated with transport in NSSs remain unknown. To elucidate structure-based mechanisms for transport in SERT we investigated its complexes with ibogaine, a hallucinogenic natural product with psychoactive and anti-addictive properties(13,14.) Notably, ibogaine is a non-competitive inhibitor of transport but displays competitive binding towards selective serotonin reuptake inhibitors(15,16). Here we report cryo-electron microscopy structures of SERT-ibogaine complexes captured in outward-open, occluded and inward-open conformations. Ibogaine binds to the central binding site, and closure of the extracellular gate largely involves movements of TMs 1b and 6a. Opening of the intracellular gate involves a hinge-like movement of TM1a and the partial unwinding of TM5, which together create a permeation pathway that enables substrate and ion diffusion to the cytoplasm. These structures define the structural rearrangements that occur from the outward-open to inward-open conformations, and provide insight into the mechanism of neurotransmitter transport and ibogaine inhibition.","[Coleman, Jonathan A.; Yang, Dongxue; Gouaux, Eric] Oregon Hlth & Sci Univ, Vollum Inst, L474, Portland, OR 97201 USA; [Zhao, Zhiyu; Wen, Po-Chao; Tajkhorshid, Emad] Univ Illinois, Ctr Biophys & Quantitat Biol, NIH Ctr Macromol Modeling & Bioinformat, Dept Biochem, Urbana, IL USA; [Zhao, Zhiyu; Wen, Po-Chao; Tajkhorshid, Emad] Univ Illinois, Beckman Inst Adv Sci & Technol, Urbana, IL USA; [Yoshioka, Craig] Oregon Hlth & Sci Univ, Dept Biomed Engn, Portland, OR 97201 USA; [Gouaux, Eric] Oregon Hlth & Sci Univ, Howard Hughes Med Inst, Portland, OR 97201 USA","Gouaux, E (corresponding author), Oregon Hlth & Sci Univ, Vollum Inst, L474, Portland, OR 97201 USA.; Gouaux, E (corresponding author), Oregon Hlth & Sci Univ, Howard Hughes Med Inst, Portland, OR 97201 USA.",gouauxe@ohsu.edu,"Gouaux, Eric/Y-4370-2019; Wen, Po-Chao/Q-5293-2019; Yoshioka, Craig/ABH-3720-2020; Tajkhorshid, Emad/AAN-8323-2021","Gouaux, Eric/0000-0002-8549-2360; Wen, Po-Chao/0000-0002-6049-6904; Coleman, Jonathan/0000-0003-0001-6195; Zhao, Zhiyu/0000-0001-9758-5073","XSEDE grant [TGMCA06N060]; Blue Waters of the National Center for Supercomputing Applications at the University of Illinois [ACI1713784]; National Institutes of HealthUnited States Department of Health & Human ServicesNational Institutes of Health (NIH) - USA [5R37MH070039, P41GM104601, U54GM087519, R01GM123455]; NATIONAL INSTITUTE OF GENERAL MEDICAL SCIENCESUnited States Department of Health & Human ServicesNational Institutes of Health (NIH) - USANIH National Institute of General Medical Sciences (NIGMS) [R01GM123455, P41GM104601, U54GM087519] Funding Source: NIH RePORTER; NATIONAL INSTITUTE OF MENTAL HEALTHUnited States Department of Health & Human ServicesNational Institutes of Health (NIH) - USANIH National Institute of Mental Health (NIMH) [R37MH070039, R01MH070039] Funding Source: NIH RePORTER","We thank the National Institute for Drug Abuse, Drug Supply Program for providing ibogaine and [3H] ibogaine, L. Vaskalis for assistance with figures, H. Owen for help with manuscript preparation, V. Navratna for discussions, and M. Whorton for help with Fab X-ray data collection. Electron microscopy was performed at Oregon Health & Science University (OHSU) at the Multiscale Microscopy Core with technical support from the OHSU-FEI Living Laboratory and OHSU Center for Spatial Systems Biomedicine. We acknowledge the staff of the Northeastern Collaborative Access Team at the Advanced Photon Source. Simulations have been performed using National Science Foundation computing resources allocated through an XSEDE grant (TGMCA06N060) to E.T., and PRAC allocation (grant ACI1713784 to E.T.) at Blue Waters of the National Center for Supercomputing Applications at the University of Illinois. We are grateful to Bernard and Jennifer LaCroute for their support. This work was funded by the National Institutes of Health (5R37MH070039 to E.G.; P41GM104601, U54GM087519 and R01GM123455 to E.T.). E.G. is an investigator of the Howard Hughes Medical Institute.",,79,60,59,2,59,NATURE PUBLISHING GROUP,LONDON,"MACMILLAN BUILDING, 4 CRINAN ST, LONDON N1 9XW, ENGLAND",0028-0836,1476-4687,,NATURE,Nature,May-02,2019,569,7754,10.1038/s41586-019-1135-1,,,Multidisciplinary Sciences,Science & Technology - Other Topics,HW2NX,WOS:000466523700049,31019304,Green Accepted,,,21/12/21,Not classic psychedelic ,,TCN
14,"Padilla-Coreano, N; Do-Monte, FH; Quirk, GJ","Padilla-Coreano, Nancy; Do-Monte, Fabricio H.; Quirk, Gregory J.",A time-dependent role of midline thalamic nuclei in the retrieval of fear memory,NEUROPHARMACOLOGY,English,Article,Thalamus; Central amygdala; Fos; Prefrontal cortex; Extinction,MEDIAL PREFRONTAL CORTEX; AMYGDALA INHIBITORY CIRCUITS; LONG-TERM-MEMORY; CONDITIONED FEAR; MEDIODORSAL NUCLEUS; PRELIMBIC CORTEX; ELECTROPHYSIOLOGICAL EVIDENCE; TEMPORARY INACTIVATION; SYNAPTIC PLASTICITY; EXTENDED AMYGDALA,"Increasing evidence indicates that the medial prefrontal cortex (mPFC) and the amygdala mediate expression and extinction of conditioned fear, but few studies have examined the inputs to these structures. The dorsal part of the midline thalamus (dMT) contains structures such as the mediodorsal nucleus, paraventricular nucleus, and paratenial nucleus that project prominently to mPFC, as well as to basal (BA) and central (Ce) nuclei of the amygdala. Using temporary inactivation with GABA agonist muscimol, we found that dMT was necessary for retrieving auditory fear memory that was 24 h old, but not 2-8 h old. However, pre-training infusions did not impair fear acquisition or extinction. To determine the possible targets of dMT that might modulate fear retrieval, we combined dMT inactivation with Fos immunohistochemistry. Rats with inactivation-induced impairment in fear retrieval showed increased Fos in the lateral division of Ce (CeL), and decreased Fos in the medial division of Ce. No differences in Fos expression were observed in the mPFC or BA. We suggest that the projections from the paraventricular nucleus to CeL are involved in retrieval of well consolidated fear memories. This article is part of a Special Issue entitled 'Anxiety and Depression'. (C) 2011 Elsevier Ltd. All rights reserved.","[Quirk, Gregory J.] Univ Puerto Rico, Sch Med, Dept Psychiat, San Juan, PR 00936 USA; Univ Puerto Rico, Sch Med, Dept Anat & Neurobiol, San Juan, PR 00936 USA","Quirk, GJ (corresponding author), Univ Puerto Rico, Sch Med, Dept Psychiat, POB 365067, San Juan, PR 00936 USA.",gjquirk@yahoo.com,"Padilla-Coreano, Nancy/ABE-5192-2020","Do Monte, Fabricio H./0000-0002-1079-0064","NIHUnited States Department of Health & Human ServicesNational Institutes of Health (NIH) - USA [MH058883, MH081975, MH086400]; UPR President's Office; MARC [GM007821]; NATIONAL INSTITUTE OF GENERAL MEDICAL SCIENCESUnited States Department of Health & Human ServicesNational Institutes of Health (NIH) - USANIH National Institute of General Medical Sciences (NIGMS) [T34GM007821] Funding Source: NIH RePORTER; NATIONAL INSTITUTE OF MENTAL HEALTHUnited States Department of Health & Human ServicesNational Institutes of Health (NIH) - USANIH National Institute of Mental Health (NIMH) [R37MH058883, R29MH058883, P50MH086400, R01MH058883, R01MH081975] Funding Source: NIH RePORTER","We thank Demetrio Sierra-Mercado for help with experiments and comments on the manuscript, and Carlos Rodriguez, Oscar Ortiz, and Zarkalys Quintero for technical help. Supported by NIH grants: MH058883 and MH081975 to GJQ MH086400 to Suzanne Haber (Conte Center), the UPR President's Office, and a MARC undergraduate fellowship (GM007821) to NPC.",,59,54,54,0,23,PERGAMON-ELSEVIER SCIENCE LTD,OXFORD,"THE BOULEVARD, LANGFORD LANE, KIDLINGTON, OXFORD OX5 1GB, ENGLAND",0028-3908,,,NEUROPHARMACOLOGY,Neuropharmacology,JAN,2012,62,1,10.1016/j.neuropharm.2011.08.037,,,Neurosciences; Pharmacology & Pharmacy,Neurosciences & Neurology; Pharmacology & Pharmacy,845MM,WOS:000296826800050,21903111,Green Accepted,,,21/12/21,Not psychedelic study ,,TCN
15,"Kjellgren, A; Jonsson, K","Kjellgren, Anette; Jonsson, Kristoffer",Methoxetamine (MXE) - A Phenomenological Study of Experiences Induced by a Legal High from the Internet,JOURNAL OF PSYCHOACTIVE DRUGS,English,Article,altered states of consciousness; hallucinogen; Internet drug; legal high; methoxetamine; MXE; psychedelic,RECREATIONAL USE; SALVIA-DIVINORUM; DEATH EXPERIENCE; KETAMINE; DEPRESSION; DEPENDENCE; PSILOCYBIN; ANESTHESIA; DRUGS,"Methoxetamine (MXE), a ketamine analogue, is one of the new legal highs sold on the Internet. The aim of this qualitative study was to provide an initial understanding of what characterizes the experiences induced by MXE. Anonymously written reports (33 persons) on the effects of MXE were collected from public Internet forums and analyzed using the Empirical Phenomenological Psychological Method. The analysis generated 10 themes: (1) preparation, motivation and anticipation; (2) initial effects; (3) malfunction of cognitive processes stabilizing normal state; (4) inner personal processes and learning; (5) emotional processes; (6) altered sensory perception; (7) dissolution and transition; (8) spiritual and transcendental experiences; (9) effects and processes after the experience; (10) re-dosing and addiction. MXE induced a heavily altered state of consciousness. The effects were similar to those induced by classic hallucinogens (such as LSD, psilocybin) and the dissociative ketamine. MXE seemed to have quite a high abuse potential. Beside the positive effects described, negative effects like fear and anxiety were also reported. Acceptance was considered the best coping strategy. Dissolution of identity and body often culminated in spiritual and transcendental experiences. More research is needed on safety issues, how to minimize harm, and the motivation for using legal highs.","[Kjellgren, Anette; Jonsson, Kristoffer] Karlstad Univ, Dept Psychol, SE-65188 Karlstad, Sweden","Kjellgren, A (corresponding author), Karlstad Univ, Dept Psychol, SE-65188 Karlstad, Sweden.",Anette.Kjellgren@kau.se,,,,,,46,50,50,2,31,"ROUTLEDGE JOURNALS, TAYLOR & FRANCIS LTD",ABINGDON,"2-4 PARK SQUARE, MILTON PARK, ABINGDON OX14 4RN, OXON, ENGLAND",0279-1072,2159-9777,,J PSYCHOACTIVE DRUGS,J. Psychoact. Drugs,JUL-AUG,2013,45,3,10.1080/02791072.2013.803647,,,"Psychology, Clinical; Substance Abuse",Psychology; Substance Abuse,265HR,WOS:000327941800010,24175493,"Green Submitted, Green Published",,,21/12/21,Not classic psychedelic ,,TCN
