21,"Nunes, AA; dos Santos, RG; Osorio, FL; Sanches, RF; Crippa, JAS; Hallak, JEC","Nunes, Amanda A.; dos Santos, Rafael G.; Osorio, Flavia L.; Sanches, Rafael F.; Crippa, Jose Alexandre S.; Hallak, Jaime E. C.",Effects of Ayahuasca and its Alkaloids on Drug Dependence: A Systematic Literature Review of Quantitative Studies in Animals and Humans,JOURNAL OF PSYCHOACTIVE DRUGS,English,Review,Ayahuasca; dependence; dimethyltryptamine; hallucinogens; harmine,"PSYCHOACTIVE BEVERAGE AYAHUASCA; RECURRENT DEPRESSION; ALCOHOL DEPENDENCE; NUCLEUS-ACCUMBENS; DOPAMINE RELEASE; BETA-CARBOLINES; HARMINE; N,N-DIMETHYLTRYPTAMINE; PHARMACOLOGY; PSILOCYBIN","Recently, the anti-addictive potential of ayahuasca, a dimethyltryptamine(DMT)- and -carboline-rich hallucinogenic beverage traditionally used by indigenous groups of the Northwest Amazon and currently by syncretic churches worldwide, has received increased attention. To better evaluate this topic, we performed a systematic literature review using the PubMed database to find quantitative studies (using statistical analysis) that assessed the effects of ayahuasca or its components in drug-related symptoms or disorders. We found five animal studies (using harmaline, harmine, or ayahuasca) and five observational studies of regular ayahuasca consumers. All animal studies showed improvement of biochemical or behavioral parameters related to drug-induced disorders. Of the five human studies, four reported significant reductions of dependence symptoms or substance use, while one did not report significant results. The mechanisms responsible for the anti-addictive properties of ayahuasca and its alkaloids are not clarified, apparently involving both peripheral MAO-A inhibition by the -carbolines and central agonism of DMT at 5-HT2A receptors expressed in brain regions related to the regulation of mood and emotions. Although results are promising, controlled studies are needed to replicate these preliminary findings.","[Nunes, Amanda A.] Univ Estadual Paulista, Inst Biosci, Botucatu, SP, Brazil; [dos Santos, Rafael G.; Osorio, Flavia L.; Sanches, Rafael F.; Crippa, Jose Alexandre S.; Hallak, Jaime E. C.] Univ Sao Paulo, Ribeirao Preto Med Sch, Dept Neurosci & Behav, Ribeirao Preto, Brazil; [dos Santos, Rafael G.] Int Ctr Ethnobot Educ Res & Serv, Amsterdam, Netherlands; [Osorio, Flavia L.; Crippa, Jose Alexandre S.; Hallak, Jaime E. C.] Natl Inst Sci & Technol Translat Med, Ribeirao Preto, Brazil","dos Santos, RG (corresponding author), Univ Sao Paulo, Hosp Clin, Fac Med Ribeirao Preto, Dept Neurociencias & Ciencias Comportamento, Terceiro Andar,Ave Bandeirantes, Ribeirao Preto, SP, Brazil.",banisteria@gmail.com,"de Souza Crippa, Jose Alexandre/A-1215-2008; Osorio, Flavia L./T-5001-2019; dos Santos, Rafael Guimaraes/F-7124-2010; Osorio, Flavia L./H-6079-2012; dos Santos, Rafael/ABF-1241-2020","dos Santos, Rafael Guimaraes/0000-0003-2388-4745; dos Santos, Rafael/0000-0003-2388-4745; L. Osorio, Flavia/0000-0003-1396-555X","Fundacao de Amparo a Pesquisa do Estado de Sao Paulo, Brazil (Fapesp)Fundacao de Amparo a Pesquisa do Estado de Sao Paulo (FAPESP) [1502848-2]; CNPq (Brazil) Productivity Fellowship AwardConselho Nacional de Desenvolvimento Cientifico e Tecnologico (CNPQ)","This research received financial support from Fundacao de Amparo a Pesquisa do Estado de Sao Paulo, Brazil (Fapesp Process No. 1502848-2). AAA is a Fellow of the Programa Institucional de Bolsas de Iniciacao Cientifica (PIBIC/CNPq), Brazil. RGS is a Fellow of the Programa Nacional de Pos-Doutorado, Brazil (PNPD/CAPES). JASC and JECH received a CNPq (Brazil) Productivity Fellowship Award. The sponsors had no role in the study design, data analysis, data interpretation, or writing of the report. All authors had full access to all of the data and had final responsibility for the decision to submit this article for publication.",,66,37,37,0,23,"ROUTLEDGE JOURNALS, TAYLOR & FRANCIS LTD",ABINGDON,"2-4 PARK SQUARE, MILTON PARK, ABINGDON OX14 4RN, OXON, ENGLAND",0279-1072,2159-9777,,J PSYCHOACTIVE DRUGS,J. Psychoact. Drugs,,2016,48,3,10.1080/02791072.2016.1188225,,,"Psychology, Clinical; Substance Abuse",Psychology; Substance Abuse,DS9JM,WOS:000381098900007,27230395,,,,21/12/21,No Liscence to use ,,TCN
22,"Geysztenkorn, D; Lee, AG","Geysztenkorn, David; Lee, Andrew G.",Palinopsia revamped: A systematic review of the literature,SURVEY OF OPHTHALMOLOGY,English,Review,palinopsia; visual perseveration; cerebral polyopia; akinetopsia; hallucinogen persisting; perception disorder; persistent migrainous aura; persistent visual aura; positive spontaneous; visual phenomena; visual snow; saccadic suppression,PERSISTING PERCEPTION DISORDER; VISUAL HALLUCINATIONS; CORTICAL EXCITABILITY; SPREADING DEPRESSION; NEURAL MECHANISMS; AFTER-IMAGES; MIGRAINE; NEFAZODONE; HYPEREXCITABILITY; PATIENT,"Palinopsia, the persistence or recurrence of visual images after the stimulus has been removed, is a nonspecific term that describes multiple types of visual symptoms with a wide variety of etiologies. For example, palinopsia may be the presenting symptom of a potentially life-threatening posterior cortical lesion, yet it may also be a benign medication side effect. We comprehensively review all published cases and subdivide palinopsia into two clinically relevant categories: illusory palinopsia and hallucinatory palinopsia. (C) 2015 Elsevier Inc. All rights reserved.","[Geysztenkorn, David] Univ Texas Med Branch, Ctr Biomed Engn, Galveston, TX 77555 USA; [Lee, Andrew G.] Houston Methodist Hosp, Dept Ophthalmol, Houston, TX 77030 USA; [Lee, Andrew G.] Houston Methodist Hosp, Dept Neurol, Houston, TX 77030 USA; [Lee, Andrew G.] Weill Cornell Med Coll, Dept Ophthalmol, New York, NY USA; [Lee, Andrew G.] Weill Cornell Med Coll, Dept Neurol, New York, NY USA; [Lee, Andrew G.] Weill Cornell Med Coll, Dept Neurosurg, New York, NY USA; [Lee, Andrew G.] Univ Texas Med Branch, Dept Ophthalmol, Galveston, TX 77555 USA; [Lee, Andrew G.] Univ Texas Med Branch, Dept Ophthalmol, Houston, TX USA; [Lee, Andrew G.] Baylor Coll Med, Houston, TX 77030 USA; [Lee, Andrew G.] Univ Iowa Hosp & Clin, Dept Ophthalmol, Iowa City, IA 52242 USA; [Lee, Andrew G.] Univ Texas MD Anderson Canc Ctr, Houston, TX 77030 USA","Lee, AG (corresponding author), Houston Methodist Hosp, Dept Ophthalmol, 6560 Fannin St,Suite 450, Houston, TX 77030 USA.",AGLee@houstonmethodist.org,,"Gersztenkorn, David/0000-0002-2595-2177",,,,154,37,38,1,17,ELSEVIER SCIENCE INC,NEW YORK,"STE 800, 230 PARK AVE, NEW YORK, NY 10169 USA",0039-6257,1879-3304,,SURV OPHTHALMOL,Surv. Ophthalmol.,JAN-FEB,2015,60,1,10.1016/j.survophthal.2014.06.003,,,Ophthalmology,Ophthalmology,AX4HA,WOS:000346892900001,25113609,,,,21/12/21,Not psychedelic study ,,TCN
23,"Simonson, B; Morani, AS; Ewald, AWM; Walker, L; Kumar, N; Simpson, D; Miller, JH; Prisinzano, TE; Kivell, BM","Simonson, B.; Morani, A. S.; Ewald, A. W. M.; Walker, L.; Kumar, N.; Simpson, D.; Miller, J. H.; Prisinzano, T. E.; Kivell, B. M.","Pharmacology and anti-addiction effects of the novel kappa opioid receptor agonist Mesyl Sal B, a potent and long-acting analogue of salvinorin A",BRITISH JOURNAL OF PHARMACOLOGY,English,Article,salvinorin A; Salvia divinorum; cocaine self-administration; drug seeking; opioid receptor; addiction; nociception; dopamine transporter,ACTIVATED PROTEIN-KINASE; DOPAMINE TRANSPORTER FUNCTION; SIGNAL-REGULATED KINASE; NUCLEUS-ACCUMBENS; HALLUCINOGEN SALVINORIN; NEOCLERODANE DITERPENES; SURFACE EXPRESSION; NONHUMAN-PRIMATES; COCAINE-SEEKING; P38-ALPHA MAPK,"Background and PurposeAcute activation of opioid (KOP) receptors results in anticocaine-like effects, but adverse effects, such as dysphoria, aversion, sedation and depression, limit their clinical development. Salvinorin A, isolated from the plant Salvia divinorum, and its semi-synthetic analogues have been shown to have potent KOP receptor agonist activity and may induce a unique response with similar anticocaine addiction effects as the classic KOP receptor agonists, but with a different side effect profile. Experimental ApproachWe evaluated the duration of effects of Mesyl Sal Bin vivo utilizing antinociception assays and screened for cocaine-prime induced cocaine-seeking behaviour in self-administering rats to predict anti-addiction effects. Cellular transporter uptake assays and in vitro voltammetry were used to assess modulation of dopamine transporter (DAT) function and to investigate transporter trafficking and kinase signalling pathways modulated by KOP receptor agonists. Key ResultsMesyl Sal B had a longer duration of action than SalA, had anti-addiction properties and increased DAT function in vitro in a KOP receptor-dependent and Pertussis toxin-sensitive manner. These effects on DAT function required ERK1/2 activation. We identified differences between Mesyl Sal B and SalA, with Mesyl Sal B increasing the V-max of dopamine uptake without altering cell-surface expression of DAT. Conclusions and ImplicationsSalA analogues, such as Mesyl Sal B, have potential for development as anticocaine agents. Further tests are warranted to elucidate the mechanisms by which the novel salvinorin-based neoclerodane diterpene KOP receptor ligands produce both anti-addiction and adverse side effects. Linked ArticlesThis article is part of a themed section on Opioids: New Pathways to Functional Selectivity. To view the other articles in this section visit","[Simonson, B.; Morani, A. S.; Ewald, A. W. M.; Walker, L.; Kumar, N.; Miller, J. H.; Kivell, B. M.] Victoria Univ Wellington, Sch Biol Sci, Ctr Biodiscovery, Wellington 6140, New Zealand; [Simpson, D.; Prisinzano, T. E.] Univ Kansas, Dept Med Chem, Lawrence, KS 66045 USA","Kivell, BM (corresponding author), Victoria Univ Wellington, Sch Biol Sci, POB 600, Wellington 6140, New Zealand.",bronwyn.kivell@vuw.ac.nz,"Prisinzano, Thomas E/B-7877-2010; Kivell, Bronwyn/P-3140-2014","Simonson, Bridget/0000-0002-3190-4796; Kivell, Bronwyn/0000-0001-9699-553X; Prisinzano, Thomas/0000-0002-0649-8052","Health Research Council of New ZealandHealth Research Council of New Zealand; Neurological Foundation of New Zealand; Wellington Medical Research Foundation; Lottery Health; National Institutes of Health, USAUnited States Department of Health & Human ServicesNational Institutes of Health (NIH) - USA [NIDA 018151]; Victoria University of Wellington, New Zealand; NATIONAL INSTITUTE ON DRUG ABUSEUnited States Department of Health & Human ServicesNational Institutes of Health (NIH) - USANIH National Institute on Drug Abuse (NIDA)European Commission [R01DA018151] Funding Source: NIH RePORTER","This work was supported by grants from the Health Research Council of New Zealand, the Neurological Foundation of New Zealand, Wellington Medical Research Foundation and Lottery Health (to BK) and the National Institutes of Health, USA (NIDA 018151 to T. E. P.). A. W. M. E., A. S. M. and B. S. received studentship awards from Victoria University of Wellington, New Zealand. The authors thank Dr Peter Bosch for technical assistance and Prof. Susan Schenk, Mr Caleb Carati and Mr Alex Crowther for their assistance with self-administration experiments.",,92,37,37,2,29,WILEY,HOBOKEN,"111 RIVER ST, HOBOKEN 07030-5774, NJ USA",0007-1188,1476-5381,,BRIT J PHARMACOL,Br. J. Pharmacol.,JAN,2015,172,2,10.1111/bph.12692,,,Pharmacology & Pharmacy,Pharmacology & Pharmacy,AX3FU,WOS:000346826500025,24641310,"Green Published, Bronze",,,21/12/21,Not psychedelic study ,,TCN
24,"Hoffman, RE; Pittman, B; Constable, RT; Bhagwagar, Z; Hampson, M","Hoffman, Ralph E.; Pittman, Brian; Constable, R. Todd; Bhagwagar, Zubin; Hampson, Michelle",Time course of regional brain activity accompanying auditory verbal hallucinations in schizophrenia,BRITISH JOURNAL OF PSYCHIATRY,English,Article,,NEURAL ACTIVITY; INNER SPEECH; BLOOD-FLOW; ACTIVATION; PERCEPTION; SERIAL; GYRUS; AREA,"Background The pathophysiology of auditory verbal hallucinations remains poorly understood. Aims To characterise the time course of regional brain activity leading to auditory verbal hallucinations. Method During functional magnetic resonance imaging, 11 patients with schizophrenia or schizoa fective disorder signalled auditory verbal hallucination events by pressing a button. To control for effects of motor behaviour, regional activity associated with hall cination events was scaled against corresponding activity arising from random button-presses produced by 10 patients who did not experience hallucinations. Results Immediately prior to the hallucinations, motor-adjusted activity in the left inferior frontal gyrus was significantly greater than corresponding activity in the right inferior frontal gyrus. In contrast, motor-adjusted activity in a right posterior temporal region overshadowed corresponding activity in the left homologous temporal region. Robustly elevated motor-adjusted activity in the left temporal region associated with auditory verbal hallucinations was also detected, but only subsequent to hallucination events. At the earliest time shift studied, the correlation between left inferior frontal gyrus and right temporal activity was significantly higher for the hallucination group compared with non-hallucinating patients. Conclusions Findings suggest that heightened functional coupling between the left inferior frontal gyrus and right temporal regions leads to coactivation in these speech processing regions that is hallucinogenic. Delayed left temporal activation may reflect impaired corollary discharge contributing to source misattribution of resulting verbal images.","[Hoffman, Ralph E.; Pittman, Brian; Bhagwagar, Zubin] Yale Univ, Sch Med, Dept Psychiat, New Haven, CT 06520 USA; [Constable, R. Todd; Hampson, Michelle] Yale Univ, Sch Med, Dept Diagnost Radiol, New Haven, CT 06520 USA","Hoffman, RE (corresponding author), Yale New Haven Psychiat Hosp, 184 Liberty St,LV108, New Haven, CT 06519 USA.",ralph.hoffman@yale.edu,"Constable, R. Todd/ABE-8038-2021; Bhagwagar, Zubin/H-1071-2012; Hampson, Michelle/K-6732-2015","Constable, R. Todd/0000-0001-5661-9521; Bhagwagar, Zubin/0000-0002-1101-768X; Hampson, Michelle/0000-0003-3173-4210","National Institute of Mental HealthUnited States Department of Health & Human ServicesNational Institutes of Health (NIH) - USANIH National Institute of Mental Health (NIMH) [R01MH073673, R01MH067073]; Dana Foundation; National Alliance for Research on Schizophrenia and Depression (NARSAD)French National Research Agency (ANR)NARSAD; National Institutes of Health NIH/NCRR/GCRCUnited States Department of Health & Human ServicesNational Institutes of Health (NIH) - USANIH National Center for Research Resources (NCRR) [RR00125]; Department of Mental Health and Addiction Services of the State of Connecticut; NATIONAL CENTER FOR RESEARCH RESOURCESUnited States Department of Health & Human ServicesNational Institutes of Health (NIH) - USANIH National Center for Research Resources (NCRR) [M01RR000125] Funding Source: NIH RePORTER; NATIONAL INSTITUTE OF MENTAL HEALTHUnited States Department of Health & Human ServicesNational Institutes of Health (NIH) - USANIH National Institute of Mental Health (NIMH) [R01MH073673, R01MH067073] Funding Source: NIH RePORTER","The study was funded by National Institute of Mental Health grants R01MH073673 and R01MH067073, the Dana Foundation, the National Alliance for Research on Schizophrenia and Depression (NARSAD), National Institutes of Health NIH/NCRR/GCRC program grant RR00125 and the Department of Mental Health and Addiction Services of the State of Connecticut.",,40,35,35,0,8,ROYAL COLLEGE OF PSYCHIATRISTS,LONDON,"BRITISH JOURNAL OF PSYCHIATRY 17 BELGRAVE SQUARE, LONDON SW1X 8PG, ENGLAND",0007-1250,,,BRIT J PSYCHIAT,Br. J. Psychiatry,APR,2011,198,4,10.1192/bjp.bp.110.086835,,,Psychiatry,Psychiatry,751IH,WOS:000289610200009,21972276,"Green Published, Bronze, Green Accepted",,,21/12/21,Schizophrenia study ,,TCN
,,,,,,,,,,,,,,,,,,,,,,,,,,,,,,,,,,,,,,,,,,,,,,,,,
1,OPINION The neurobiology of psychedelic drugs: implications for the treatment of mood disorders,"Vollenweider, Franz X.; Kometer, Michael",NATURE REVIEWS NEUROSCIENCE,SEP 2010,2010,11,9,642,651,,10.1038/nrn2884,314,26.17,0,8,25,16,21,17,35,26,43,30,44,49,0,Not open content ,,,,,,,,,,,,,,,,,,,,,ACN,
2,"Coleman, JA; Yang, DX; Zhao, ZY; Wen, PC; Yoshioka, C; Tajkhorshid, E; Gouaux, E","Coleman, Jonathan A.; Yang, Dongxue; Zhao, Zhiyu; Wen, Po-Chao; Yoshioka, Craig; Tajkhorshid, Emad; Gouaux, Eric",Serotonin transporter-ibogaine complexes illuminate mechanisms of inhibition and transport,NATURE,English,Article,,GENERAL FORCE-FIELD; X-RAY STRUCTURES; MOLECULAR-DYNAMICS; NEUROTRANSMITTER TRANSPORTERS; SOFTWARE NEWS; FACING STATE; BINDING; LEUT; VALIDATION; SITE,"The serotonin transporter (SERT) regulates neurotransmitter homeostasis through the sodium- and chloride-dependent recycling of serotonin into presynaptic neurons(1-3). Major depression and anxiety disorders are treated using selective serotonin reuptake inhibitors-small molecules that competitively block substrate binding and thereby prolong neurotransmitter action(2,4). The dopamine and noradrenaline transporters, together with SERT, are members of the neurotransmitter sodium symporter (NSS) family. The transport activities of NSSs can be inhibited or modulated by cocaine and amphetamines(2,3), and genetic variants of NSSs are associated with several neuropsychiatric disorders including attention deficit hyperactivity disorder, autism and bipolar disorder(2,5). Studies of bacterial NSS homologues-including LeuT-have shown how their transmembrane helices (TMs) undergo conformational changes during the transport cycle, exposing a central binding site to either side of the membrane(1,6-12). However, the conformational changes associated with transport in NSSs remain unknown. To elucidate structure-based mechanisms for transport in SERT we investigated its complexes with ibogaine, a hallucinogenic natural product with psychoactive and anti-addictive properties(13,14.) Notably, ibogaine is a non-competitive inhibitor of transport but displays competitive binding towards selective serotonin reuptake inhibitors(15,16). Here we report cryo-electron microscopy structures of SERT-ibogaine complexes captured in outward-open, occluded and inward-open conformations. Ibogaine binds to the central binding site, and closure of the extracellular gate largely involves movements of TMs 1b and 6a. Opening of the intracellular gate involves a hinge-like movement of TM1a and the partial unwinding of TM5, which together create a permeation pathway that enables substrate and ion diffusion to the cytoplasm. These structures define the structural rearrangements that occur from the outward-open to inward-open conformations, and provide insight into the mechanism of neurotransmitter transport and ibogaine inhibition.","[Coleman, Jonathan A.; Yang, Dongxue; Gouaux, Eric] Oregon Hlth & Sci Univ, Vollum Inst, L474, Portland, OR 97201 USA; [Zhao, Zhiyu; Wen, Po-Chao; Tajkhorshid, Emad] Univ Illinois, Ctr Biophys & Quantitat Biol, NIH Ctr Macromol Modeling & Bioinformat, Dept Biochem, Urbana, IL USA; [Zhao, Zhiyu; Wen, Po-Chao; Tajkhorshid, Emad] Univ Illinois, Beckman Inst Adv Sci & Technol, Urbana, IL USA; [Yoshioka, Craig] Oregon Hlth & Sci Univ, Dept Biomed Engn, Portland, OR 97201 USA; [Gouaux, Eric] Oregon Hlth & Sci Univ, Howard Hughes Med Inst, Portland, OR 97201 USA","Gouaux, E (corresponding author), Oregon Hlth & Sci Univ, Vollum Inst, L474, Portland, OR 97201 USA.; Gouaux, E (corresponding author), Oregon Hlth & Sci Univ, Howard Hughes Med Inst, Portland, OR 97201 USA.",gouauxe@ohsu.edu,"Gouaux, Eric/Y-4370-2019; Wen, Po-Chao/Q-5293-2019; Yoshioka, Craig/ABH-3720-2020; Tajkhorshid, Emad/AAN-8323-2021","Gouaux, Eric/0000-0002-8549-2360; Wen, Po-Chao/0000-0002-6049-6904; Coleman, Jonathan/0000-0003-0001-6195; Zhao, Zhiyu/0000-0001-9758-5073","XSEDE grant [TGMCA06N060]; Blue Waters of the National Center for Supercomputing Applications at the University of Illinois [ACI1713784]; National Institutes of HealthUnited States Department of Health & Human ServicesNational Institutes of Health (NIH) - USA [5R37MH070039, P41GM104601, U54GM087519, R01GM123455]; NATIONAL INSTITUTE OF GENERAL MEDICAL SCIENCESUnited States Department of Health & Human ServicesNational Institutes of Health (NIH) - USANIH National Institute of General Medical Sciences (NIGMS) [R01GM123455, P41GM104601, U54GM087519] Funding Source: NIH RePORTER; NATIONAL INSTITUTE OF MENTAL HEALTHUnited States Department of Health & Human ServicesNational Institutes of Health (NIH) - USANIH National Institute of Mental Health (NIMH) [R37MH070039, R01MH070039] Funding Source: NIH RePORTER","We thank the National Institute for Drug Abuse, Drug Supply Program for providing ibogaine and [3H] ibogaine, L. Vaskalis for assistance with figures, H. Owen for help with manuscript preparation, V. Navratna for discussions, and M. Whorton for help with Fab X-ray data collection. Electron microscopy was performed at Oregon Health & Science University (OHSU) at the Multiscale Microscopy Core with technical support from the OHSU-FEI Living Laboratory and OHSU Center for Spatial Systems Biomedicine. We acknowledge the staff of the Northeastern Collaborative Access Team at the Advanced Photon Source. Simulations have been performed using National Science Foundation computing resources allocated through an XSEDE grant (TGMCA06N060) to E.T., and PRAC allocation (grant ACI1713784 to E.T.) at Blue Waters of the National Center for Supercomputing Applications at the University of Illinois. We are grateful to Bernard and Jennifer LaCroute for their support. This work was funded by the National Institutes of Health (5R37MH070039 to E.G.; P41GM104601, U54GM087519 and R01GM123455 to E.T.). E.G. is an investigator of the Howard Hughes Medical Institute.",,79,60,59,2,59,NATURE PUBLISHING GROUP,LONDON,"MACMILLAN BUILDING, 4 CRINAN ST, LONDON N1 9XW, ENGLAND",0028-0836,1476-4687,,NATURE,Nature,May-02,2019,569,7754,10.1038/s41586-019-1135-1,,,Multidisciplinary Sciences,Science & Technology - Other Topics,HW2NX,WOS:000466523700049,31019304,Green Accepted,,,21/12/21,Not classic psychedelic ,ACN,
