7,"Holloway, T; Moreno, JL; Umali, A; Rayannavar, V; Hodes, GE; Russo, SJ; Gonzalez-Maeso, J","Holloway, Terrell; Moreno, Jose L.; Umali, Adrienne; Rayannavar, Vinayak; Hodes, Georgia E.; Russo, Scott J.; Gonzalez-Maeso, Javier",Prenatal Stress Induces Schizophrenia-Like Alterations of Serotonin 2A and Metabotropic Glutamate 2 Receptors in the Adult Offspring: Role of Maternal Immune System,JOURNAL OF NEUROSCIENCE,English,Article,,BRAIN-DEVELOPMENT; PSYCHIATRIC-DISORDERS; SEX-DIFFERENCES; ANIMAL-MODELS; RISK; ACTIVATION; EXPOSURE; INFLUENZA; 5-HT2A; MGLU2,"It has been suggested that severe adverse life events during pregnancy increase the risk of schizophrenia in the offspring. The serotonin 5-HT2A and the metabotropic glutamate 2 (mGlu2) receptors both have been the target of considerable attention regarding schizophrenia and antipsychotic drug development. We tested the effects of maternal variable stress during pregnancy on expression and behavioral function of these two receptors in mice. Prenatal stress increased 5-HT2A and decreased mGlu2 expression in frontal cortex, a brain region involved in perception, cognition, and mood. This pattern of expression of 5-HT2A and mGlu2 receptors was consistent with behavioral alterations, including increased head-twitch response to the hallucinogenic 5-HT2A agonist DOI [ 1-(2,5-dimethoxy-4-iodophenyl)-2-aminopropane] and decreased mGlu2-dependent antipsychotic-like effect of the mGlu2/3 agonist LY379268 (1R,4R,5S,6R-2-oxa-4-aminobicyclo[3.1.0]hexane-4,6-dicarboxylate) in adult, but not prepubertal, mice born to stressed mothers during pregnancy. Cross-fostering studies determined that these alterations were not attributable to effects of prenatal stress on maternal care. Additionally, a similar pattern of biochemical and behavioral changes were observed in mice born to mothers injected with polyinosinic:polycytidylic acid [poly(I: C)] during pregnancy as a model of prenatal immune activation. These data strengthen pathophysiological hypotheses that propose an early neurodevelopmental origin for schizophrenia and other psychiatric disorders.","[Holloway, Terrell; Moreno, Jose L.; Umali, Adrienne; Rayannavar, Vinayak; Gonzalez-Maeso, Javier] Mt Sinai Sch Med, Dept Psychiat, New York, NY 10029 USA; [Gonzalez-Maeso, Javier] Mt Sinai Sch Med, Dept Neurol, New York, NY 10029 USA; [Hodes, Georgia E.; Russo, Scott J.] Mt Sinai Sch Med, Dept Neurosci, New York, NY 10029 USA; [Russo, Scott J.; Gonzalez-Maeso, Javier] Mt Sinai Sch Med, Friedman Brain Inst, New York, NY 10029 USA","Gonzalez-Maeso, J (corresponding author), Mt Sinai Sch Med, Dept Psychiat, 1425 Madison Ave,Box 1229, New York, NY 10029 USA.",Javier.Maeso@mssm.edu,"Hodes, Georgia/L-8022-2016; Russo, Scott/R-7107-2019; Moreno, Jose L/L-8981-2017","Hodes, Georgia/0000-0002-1551-2178; Russo, Scott/0000-0002-6470-1805; ","National Institutes of HealthUnited States Department of Health & Human ServicesNational Institutes of Health (NIH) - USA [R01 MH084894, R01 MH090264]; Dainippon Sumitomo PharmaDainippon Sumitomo Pharma Co., Ltd.; National Alliance for Research on Schizophrenia and DepressionNARSAD; Mortimer D. Sackler Foundation; NATIONAL INSTITUTE OF MENTAL HEALTHUnited States Department of Health & Human ServicesNational Institutes of Health (NIH) - USANIH National Institute of Mental Health (NIMH) [R01MH090264, R01MH084894] Funding Source: NIH RePORTER","This work was supported by National Institutes of Health Grant R01 MH084894 (J.G.-M.) and R01 MH090264 (S.J.R.), Dainippon Sumitomo Pharma (J.G.-M.), National Alliance for Research on Schizophrenia and Depression (J.G.-M.), and the Mortimer D. Sackler Foundation (J.G.-M.).",,76,84,84,1,27,SOC NEUROSCIENCE,WASHINGTON,"11 DUPONT CIRCLE, NW, STE 500, WASHINGTON, DC 20036 USA",0270-6474,1529-2401,,J NEUROSCI,J. Neurosci.,Jan-16,2013,33,3,10.1523/JNEUROSCI.2331-12.2013,,,Neurosciences,Neurosciences & Neurology,076KI,WOS:000313955000024,23325246,"Green Accepted, Bronze, Green Published",,,21/12/21,Schizophrenia study ,,TCN
8,"Moreno, JL; Muguruza, C; Umali, A; Mortillo, S; Holloway, T; Pilar-Cuellar, F; Mocci, G; Seto, J; Callado, LF; Neve, RL; Milligan, G; Sealfon, SC; Lopez-Gimenez, JF; Meana, JJ; Benson, DL; Gonzalez-Maeso, J","Moreno, Jose L.; Muguruza, Carolina; Umali, Adrienne; Mortillo, Steven; Holloway, Terrell; Pilar-Cuellar, Fuencisla; Mocci, Giuseppe; Seto, Jeremy; Callado, Luis F.; Neve, Rachael L.; Milligan, Graeme; Sealfon, Stuart C.; Lopez-Gimenez, Juan F.; Javier Meana, J.; Benson, Deanna L.; Gonzalez-Maeso, Javier",Identification of Three Residues Essential for 5-Hydroxytryptamine 2A-Metabotropic Glutamate 2 (5-HT2A.mGlu2) Receptor Heteromerization and Its Psychoactive Behavioral Function,JOURNAL OF BIOLOGICAL CHEMISTRY,English,Article,,PROTEIN-COUPLED RECEPTORS; CRYSTAL-STRUCTURE; CLASS-A; GPCR; RHODOPSIN; COMPLEX; MODELS; OLIGOMERIZATION; ORGANIZATION; PHARMACOLOGY,"Serotonin and glutamate G protein-coupled receptor (GPCR) neurotransmission affects cognition and perception in humans and rodents. GPCRs are capable of forming heteromeric complexes that differentially alter cell signaling, but the role of this structural arrangement in modulating behavior remains unknown. Here, we identified three residues located at the intracellular end of transmembrane domain four that are necessary for the metabotropic glutamate 2 (mGlu2) receptor to be assembled as a GPCR heteromer with the serotonin 5-hydroxytryptamine 2A (5-HT2A) receptor in the mouse frontal cortex. Substitution of these residues (Ala-677(4.40), Ala-681(4.44), and Ala-685(4.48)) leads to absence of 5-HT2A.mGlu2 receptor complex formation, an effect that is associated with a decrease in their heteromeric ligand binding interaction. Disruption of heteromeric expression with mGlu2 attenuates the psychosis-like effects induced in mice by hallucinogenic 5-HT2A agonists. Furthermore, the ligand binding interaction between the components of the 5-HT2A.mGlu2 receptor heterocomplex is up-regulated in the frontal cortex of schizophrenic subjects as compared with controls. Together, these findings provide structural evidence for the unique behavioral function of a GPCR heteromer.","[Moreno, Jose L.; Umali, Adrienne; Holloway, Terrell; Pilar-Cuellar, Fuencisla; Mocci, Giuseppe; Gonzalez-Maeso, Javier] Mt Sinai Sch Med, Dept Psychiat, New York, NY 10029 USA; [Seto, Jeremy; Sealfon, Stuart C.; Gonzalez-Maeso, Javier] Mt Sinai Sch Med, Dept Neurol, New York, NY 10029 USA; [Mortillo, Steven; Sealfon, Stuart C.; Benson, Deanna L.] Mt Sinai Sch Med, Dept Neurosci, New York, NY 10029 USA; [Sealfon, Stuart C.] Mt Sinai Sch Med, Ctr Translat Syst Biol, New York, NY 10029 USA; [Sealfon, Stuart C.; Benson, Deanna L.; Gonzalez-Maeso, Javier] Mt Sinai Sch Med, Friedman Brain Inst, New York, NY 10029 USA; [Muguruza, Carolina; Callado, Luis F.; Javier Meana, J.] Univ Pais Vasco Euskal Herriko Unibertsitatea, Univ Basque Country, Dept Pharmacol, E-48490 Leioa, Bizkaia, Spain; [Umali, Adrienne; Callado, Luis F.; Javier Meana, J.] Univ Pais Vasco Euskal Herriko Unibertsitatea, Univ Basque Country, Ctr Invest Biomed Red Salud Mental, E-48490 Leioa, Bizkaia, Spain; [Lopez-Gimenez, Juan F.] Fac Med, Inst Biomed Biotecnol Cantabria, E-39011 Santander, Spain; [Milligan, Graeme; Lopez-Gimenez, Juan F.] Univ Glasgow, Coll Med Vet & Life Sci, Inst Mol Cell & Syst Biol, Mol Pharmacol Grp, Glasgow G12 8QQ, Lanark, Scotland; [Neve, Rachael L.] MIT, Dept Brain & Cognit Sci, Cambridge, MA 02139 USA","Gonzalez-Maeso, J (corresponding author), Mt Sinai Sch Med, Dept Psychiat, 1425 Madison Ave,Box 1229, New York, NY 10029 USA.",Javier.Maeso@mssm.edu,"Lopez-Gimenez, Juan/K-5823-2014; Callado, Luis F/A-7024-2008; Muguruza, Carolina/AAR-4531-2021; Muguruza, Carolina/B-8986-2013; Pilar-Cuellar, Fuencisla/L-2983-2014; Moreno, Jose L/L-8981-2017; Milligan, Graeme/F-9426-2011","Lopez-Gimenez, Juan/0000-0003-3021-6200; Callado, Luis F/0000-0001-9941-012X; Muguruza, Carolina/0000-0002-0477-5757; Muguruza, Carolina/0000-0002-0477-5757; Pilar-Cuellar, Fuencisla/0000-0003-1229-001X; Milligan, Graeme/0000-0002-6946-3519; MEANA, JOSE JAVIER/0000-0002-7913-6714; Benson, Deanna/0000-0001-7037-1147; CALLADO HERNANDO, LUIS FELIPE/0000-0002-5564-3447; SEALFON, Stuart/0000-0001-5791-1217","National Institutes of HealthUnited States Department of Health & Human ServicesNational Institutes of Health (NIH) - USA [R01 MH084894, R01 NS37731, P01 DA12923]; Dainippon Sumi-tomo PharmaDainippon Sumitomo Pharma Co., Ltd.; National Alliance for Research on Schizophrenia and DepressionNARSAD; Mortimer D. Sackler Foundation; Ministerio de Ciencia e Innovacion GrantSpanish Government [SAF2009-084609]; Basque GovernmentBasque Government [IT-199-07]; Consejo Superior de Investigaciones Cientificas Grants [PA1003176, 200980I110]; Medical Research Council United KingdomUK Research & Innovation (UKRI)Medical Research Council UK (MRC) [G0900050]; University of the Basque Country, Spain; Fundacion Alicia Koplowitz, Spain; Consejo Superior de Investigaciones Cientificas, Spain; MRCUK Research & Innovation (UKRI)Medical Research Council UK (MRC) [G0900050] Funding Source: UKRI; Medical Research CouncilUK Research & Innovation (UKRI)Medical Research Council UK (MRC)European Commission [G0900050] Funding Source: researchfish; NATIONAL INSTITUTE OF MENTAL HEALTHUnited States Department of Health & Human ServicesNational Institutes of Health (NIH) - USANIH National Institute of Mental Health (NIMH) [R01MH084894] Funding Source: NIH RePORTER; NATIONAL INSTITUTE OF NEUROLOGICAL DISORDERS AND STROKEUnited States Department of Health & Human ServicesNational Institutes of Health (NIH) - USANIH National Institute of Neurological Disorders & Stroke (NINDS) [R01NS037731] Funding Source: NIH RePORTER; NATIONAL INSTITUTE ON DRUG ABUSEUnited States Department of Health & Human ServicesNational Institutes of Health (NIH) - USANIH National Institute on Drug Abuse (NIDA)European Commission [P01DA012923] Funding Source: NIH RePORTER","This work was supported, in whole or in part, by National Institutes of Health Grants R01 MH084894 (to J. G. M.), R01 NS37731 (to D. L. B.), and P01 DA12923 (to S. C. S.). This work was also supported by Dainippon Sumi-tomo Pharma (to J. G. M.), National Alliance for Research on Schizophrenia and Depression (to J. G. M.), The Mortimer D. Sackler Foundation (to J. G. M.), Ministerio de Ciencia e Innovacion Grant SAF2009-084609 (to J. J. M.), Basque Government Grant IT-199-07 (to J. J. M.), Consejo Superior de Investigaciones Cientificas Grants PA1003176 and 200980I110 (to J. F. L.-G.), and Medical Research Council United Kingdom Grant G0900050 (to G. M.).; Recipient of a predoctoral fellowship from University of the Basque Country, Spain.; Recipient of a postdoctoral fellowship from Fundacion Alicia Koplowitz, Spain.; Recipient of a predoctoral fellowship from Consejo Superior de Investigaciones Cientificas, Spain.",,63,79,82,0,35,AMER SOC BIOCHEMISTRY MOLECULAR BIOLOGY INC,BETHESDA,"9650 ROCKVILLE PIKE, BETHESDA, MD 20814-3996 USA",,1083-351X,,J BIOL CHEM,J. Biol. Chem.,Dec-28,2012,287,53,10.1074/jbc.M112.413161,,,Biochemistry & Molecular Biology,Biochemistry & Molecular Biology,062RI,WOS:000312938600028,23129762,"hybrid, Green Published, Green Submitted",,,21/12/21,Not classic psychedelic ,,TCN
9,"Moreno, JL; Kurita, M; Holloway, T; Lopez, J; Cadagan, R; Martinez-Sobrido, L; Garcia-Sastre, A; Gonzalez-Maeso, J","Moreno, Jose L.; Kurita, Mitsumasa; Holloway, Terrell; Lopez, Javier; Cadagan, Richard; Martinez-Sobrido, Luis; Garcia-Sastre, Adolfo; Gonzalez-Maeso, Javier",Maternal Influenza Viral Infection Causes Schizophrenia-Like Alterations of 5-HT2A and mGlu(2) Receptors in the Adult Offspring,JOURNAL OF NEUROSCIENCE,English,Article,,PRENATAL IMMUNE CHALLENGE; FETAL-BRAIN-DEVELOPMENT; ANIMAL-MODEL; GLUCOSE-METABOLISM; RODENT MODELS; VIRUS; AGONIST; RISK; ACTIVATION; EXPRESSION,"Epidemiological studies indicate that maternal influenza viral infection increases the risk for schizophrenia in the adult offspring. The serotonin and glutamate systems are suspected in the etiology of schizophrenia, as well as in the mechanism of action of antipsychotic drugs. The effects of hallucinogens, such as psilocybin and mescaline, require the serotonin 5-HT2A receptor, and induce schizophrenia-like psychosis in humans. In addition, metabotropic glutamate receptor mGlu(2/3) agonists show promise as a new treatment for schizophrenia. Here, we investigated the level of expression and behavioral function of 5-HT2A and mGlu(2) receptors in a mouse model of maternal influenza viral infection. We show that spontaneous locomotor activity is diminished by maternal infection with the mouse-adapted influenza A/WSN/33 (H1N1) virus. The behavioral responses to hallucinogens and glutamate antipsychotics are both affected by maternal exposure to influenza virus, with increased head-twitch response to hallucinogens and diminished antipsychotic-like effect of the glutamate agonist. In frontal cortex of mice born to influenza virus-infected mothers, the 5-HT2A receptor is upregulated and the mGlu(2) receptor is downregulated, an alteration that may be involved in the behavioral changes observed. Additionally, we find that the cortical 5-HT2A receptor-dependent signaling pathways are significantly altered in the offspring of infected mothers, showing higher c-fos, egr-1, and egr-2 expression in response to the hallucinogenic drug DOI. Identifying a biochemical alteration that parallels the behavioral changes observed in a mouse model of prenatal viral infection may facilitate targeting therapies for treatment and prevention of schizophrenia.","[Moreno, Jose L.; Kurita, Mitsumasa; Holloway, Terrell; Lopez, Javier; Gonzalez-Maeso, Javier] Mt Sinai Sch Med, Dept Psychiat, New York, NY 10029 USA; [Lopez, Javier; Gonzalez-Maeso, Javier] Mt Sinai Sch Med, Dept Neurol, New York, NY 10029 USA; [Cadagan, Richard; Martinez-Sobrido, Luis; Garcia-Sastre, Adolfo] Mt Sinai Sch Med, Dept Microbiol, New York, NY 10029 USA; [Garcia-Sastre, Adolfo] Mt Sinai Sch Med, Dept Med, New York, NY 10029 USA; [Gonzalez-Maeso, Javier] Mt Sinai Sch Med, Friedman Brain Inst, New York, NY 10029 USA; [Garcia-Sastre, Adolfo] Mt Sinai Sch Med, Global Hlth & Emerging Pathogens Inst, New York, NY 10029 USA","Gonzalez-Maeso, J (corresponding author), Mt Sinai Sch Med, Dept Psychiat, 1425 Madison Ave,Box 1229, New York, NY 10029 USA.",Javier.Maeso@mssm.edu,,"Garcia-Sastre, Adolfo/0000-0002-6551-1827; Martinez-Sobrido, Luis/0000-0001-7084-0804","National Institute of Mental HealthUnited States Department of Health & Human ServicesNational Institutes of Health (NIH) - USANIH National Institute of Mental Health (NIMH) [5R01MH084894]; Dainippon Sumitomo PharmaDainippon Sumitomo Pharma Co., Ltd.; National Alliance for Research on Schizophrenia and Depression Young Investigator AwardNARSAD; Maltz Family Foundation; Center for Research on Influenza Pathogenesis through National Institute of Allergy and Infectious DiseasesUnited States Department of Health & Human ServicesNational Institutes of Health (NIH) - USANIH National Institute of Allergy & Infectious Diseases (NIAID) [HHSN266200700010C]; Ministerio de Ciencia e Innovacion, SpainSpanish Government; NATIONAL INSTITUTE OF MENTAL HEALTHUnited States Department of Health & Human ServicesNational Institutes of Health (NIH) - USANIH National Institute of Mental Health (NIMH) [R01MH084894] Funding Source: NIH RePORTER","This work was supported by National Institute of Mental Health Grant 5R01MH084894 and Dainippon Sumitomo Pharma, as well as a National Alliance for Research on Schizophrenia and Depression Young Investigator Award and Maltz Family Foundation Award to J.G.-M. This study was also partly funded by the Center for Research on Influenza Pathogenesis to A.G.-S. through National Institute of Allergy and Infectious Diseases Contract HHSN266200700010C. J.L.M. was the recipient of a postdoctoral fellowship from Ministerio de Ciencia e Innovacion, Spain. We thank C. Alberini and S. Salton for critical reading of the manuscript and E. Nistal-Villan for providing viral stocks.",,81,78,81,1,25,SOC NEUROSCIENCE,WASHINGTON,"11 DUPONT CIRCLE, NW, STE 500, WASHINGTON, DC 20036 USA",0270-6474,1529-2401,,J NEUROSCI,J. Neurosci.,Feb-02,2011,31,5,10.1523/JNEUROSCI.4230-10.2011,,,Neurosciences,Neurosciences & Neurology,715WE,WOS:000286922100035,21289196,"Green Accepted, Green Published, Bronze",,,21/12/21,Schizophrenia study ,,TCN
10,"Ranganathan, M; Schnakenberg, A; Skosnik, PD; Cohen, BM; Pittman, B; Sewell, RA; D'Souza, DC","Ranganathan, Mohini; Schnakenberg, Ashley; Skosnik, Patrick D.; Cohen, Bruce M.; Pittman, Brian; Sewell, R. Andrew; D'Souza, Deepak Cyril","Dose-Related Behavioral, Subjective, Endocrine, and Psychophysiological Effects of the kappa Opioid Agonist Salvinorin A in Humans",BIOLOGICAL PSYCHIATRY,English,Article,Hallucinogen; kappa-opioid; perception; psychosis; Salvia; Salvinorin A,SALVIA-DIVINORUM USE; RECEPTOR-AGONIST; MOTIVATIONAL PROPERTIES; DOPAMINE RELEASE; PLACE PREFERENCE; MU-OPIATE; COCAINE; SENSITIZATION; HALLUCINOGEN; MORPHINE,"Background: Salvia divinorum (Salvia) is an increasingly popular recreational drug amongst adolescents and young adults. Its primary active ingredient, Salvinorin A (SA)-a highly selective agonist at the kappa opiate receptor-is believed to be one of the most potent naturally occurring hallucinogens. However, there is little experimental data on the effects of SA in humans. Methods: In a 3-day, double-blind, randomized, crossover, counterbalanced study, the behavioral, subjective, cognitive, psychophysiological, and endocrine effects of 0 mg, 8 mg, and 12 mg of inhaled SA were characterized in 10 healthy individuals who had previously used Salvia. Results: SA produced psychotomimetic effects and perceptual alterations, including dissociative and somaesthetic effects, increased plasma cortisol and prolactin, and reduced resting electroencephalogram spectral power. The SA administration was associated with a rapid increase of its levels in the blood. SA did not produce euphoria, cognitive deficits, or changes in vital signs. The effects were transient and not dose-related. SA administration was very well-tolerated without acute or delayed adverse effects. Conclusions: SA produced a wide range of transient effects in healthy subjects. The perceptual altering effects and lack of euphoric effects would explain its intermittent use pattern. Such a profile would also suggest a low addictive potential similar to other hallucinogens and consistent with kappa opiate receptor agonism. Further work is warranted to carefully characterize a full spectrum of its effects in humans, to elucidate the underlying mechanisms involved, and to explore the basis for individual variability in its effects.","[Ranganathan, Mohini; Schnakenberg, Ashley; Skosnik, Patrick D.; Sewell, R. Andrew; D'Souza, Deepak Cyril] Vet Affairs Connecticut Healthcare Syst, Psychiat Serv, West Haven, CT USA; [Ranganathan, Mohini; Schnakenberg, Ashley; Skosnik, Patrick D.; Pittman, Brian; Sewell, R. Andrew; D'Souza, Deepak Cyril] Connecticut Mental Hlth Ctr, Abraham Ribicoff Res Facil, New Haven, CT 06519 USA; [Ranganathan, Mohini; Schnakenberg, Ashley; Skosnik, Patrick D.; Pittman, Brian; Sewell, R. Andrew; D'Souza, Deepak Cyril] Yale Univ, Dept Psychiat, Sch Med, New Haven, CT 06520 USA; Harvard Univ, Sch Med, Boston, MA USA; [Cohen, Bruce M.] McLean Hosp, Belmont, MA 02178 USA","Ranganathan, M (corresponding author), VA Connecticut Healthcare Syst, Psychiat Serv, 116A,950 Campbell Ave, West Haven, CT 06516 USA.",mohini.ranganathan@yale.edu,"Cohen, Bruce M./AAZ-4986-2020",,National Alliance for Research on Schizophrenia and Depression Young Investigator AwardNARSAD; National Institute on Drug AbuseUnited States Department of Health & Human ServicesNational Institutes of Health (NIH) - USANIH National Institute on Drug Abuse (NIDA)European Commission [R21 DA029826-01A1]; Department of Veterans AffairsUS Department of Veterans Affairs; National Institute of Mental HealthUnited States Department of Health & Human ServicesNational Institutes of Health (NIH) - USANIH National Institute of Mental Health (NIMH); National Institute of Drug AbuseUnited States Department of Health & Human ServicesNational Institutes of Health (NIH) - USANIH National Institute on Drug Abuse (NIDA); National Institute of Alcoholism and Alcohol AbuseUnited States Department of Health & Human ServicesNational Institutes of Health (NIH) - USANIH National Institute on Alcohol Abuse & Alcoholism (NIAAA); Yale Center for Clinical Investigation; Eli LillyEli Lilly; Astra ZenecaAstraZeneca; Abbott LaboratoriesAbbott Laboratories; Organon; PfizerPfizer; Sanofi; NATIONAL INSTITUTE ON DRUG ABUSEUnited States Department of Health & Human ServicesNational Institutes of Health (NIH) - USANIH National Institute on Drug Abuse (NIDA)European Commission [R21DA029826] Funding Source: NIH RePORTER,"This research project was funded in part by a National Alliance for Research on Schizophrenia and Depression Young Investigator Award to MR and a grant from the National Institute on Drug Abuse (R21 DA029826-01A1) to MR. We wish to acknowledge support from: 1) the Department of Veterans Affairs, 2) National Institute of Mental Health, 3) National Institute of Drug Abuse, 4) National Institute of Alcoholism and Alcohol Abuse, and 5) the Yale Center for Clinical Investigation. We also thank Angelina Genovese, R.N.C., M. B. A.; Michelle San Pedro, R.N.; Elizabeth O'Donnell, R.N.; Brenda Breault, R.N., B. S.N.; SonahYoo, R.Ph.; Rachel Galvan, R.Ph.; and Willie Ford at the Veterans Affairs Connecticut Healthcare System, West Haven Campus for their contributions to the success of this project.; Mohini Ranganathan has received research grant support administered through Yale University School of Medicine from Eli Lilly. Deepak Cyril D'Souza received research grant support administered through Yale University School of Medicine from Astra Zeneca, Abbott Laboratories, Eli Lilly, Organon, Pfizer, and Sanofi; he is a consultant for Bristol Myers Squibb. Patrick Skosnik, Ashley Schnakenberg, Brian Pittman, Andrew Sewell, and Bruce Cohen report no biomedical financial interests or potential conflicts of interest.",,85,75,79,1,39,ELSEVIER SCIENCE INC,NEW YORK,"STE 800, 230 PARK AVE, NEW YORK, NY 10169 USA",0006-3223,1873-2402,,BIOL PSYCHIAT,Biol. Psychiatry,Nov-15,2012,72,10,10.1016/j.biopsych.2012.06.012,,,Neurosciences; Psychiatry,Neurosciences & Neurology; Psychiatry,027KT,WOS:000310351800016,22817868,Green Accepted,,,21/12/21,Not psychedelic study ,,TCN
